CFDA number,CFDA Program Title,Failed Metric,CFDA Program Obligation,USASpending Obligation
23.001,Appalachian Regional Development (See individual Appalachian Programs),consistency,68286799.00,
23.002,Appalachian Area Development,timeliness,68286799.00
23.003,Appalachian Development Highway System,consistency,323953630.00,0.00
23.011,"Appalachian Research, Technical Assistance, and Demonstration Projects",consistency,929971.00,3755265.00
94.002,Retired and Senior Volunteer Program,completeness,56870000.00
94.003,State Commissions,completeness,11742738.00
94.006,AmeriCorps,completeness,226792326.00
94.007,Program Development and Innovation Grants,consistency,1.00,39528301.00
94.011,Foster Grandparent Program,completeness,108574000.00
94.016,Senior Companion Program,completeness,45494000.00
94.017,Senior Demonstration Program,consistency,323000.00,90000.00
90.100,Denali Commission Program,consistency,21000000.00,
90.201,Delta Area Economic Development,consistency,7789000.00,
90.202,Delta Local Development District Assistance,consistency,396000.00,
90.300,Japan-U.S. Friendship Commission Grants,consistency,1569383.00,
90.400,Help America Vote College Program,consistency,750000.00,
90.402,Help America Vote Mock Election Program,completeness,200000.00
90.500,International Broadcasting Independent Grantee Organizations,consistency,207552000.00,
10.202,Cooperative Forestry Research,timeliness,23420475.00
10.207,Animal Health and Disease Research,timeliness,4614897.00
10.222,Tribal Colleges Endowment Program,consistency,3080640.00,
10.553,School Breakfast Program,consistency,2393028000.00,
10.555,National School Lunch Program,consistency,8209848000.00,
10.556,Special Milk Program for Children,consistency,15120000.00,
10.557,"Special Supplemental Nutrition Program for Women, Infants, and Children",consistency,6250280000.00,1696352767.00
10.558,Child and Adult Care Food Program,consistency,2286629000.00,677572.00
10.559,Summer Food Service Program for Children,consistency,312637000.00,
10.560,State Administrative Expenses for Child Nutrition,timeliness,174134000.00
10.561,State Administrative Matching Grants for the Supplemental Nutrition Assistance Program,timeliness,2620000000.00
10.565,Commodity Supplemental Food Program,consistency,140806821.00,29593303.00
10.569,Emergency Food Assistance Program (Food Commodities),consistency,140000000.00,
10.572,WIC Farmers' Market Nutrition Program (FMNP),consistency,19860000.00,3455814.00
10.666,Schools and Roads - Grants to Counties,consistency,15718200.00,7500.00
10.001,Agricultural Research_Basic and Applied Research,consistency,20295111.00,64402323.00
10.156,Federal-State Marketing Improvement Program,consistency,3186537.00,603635.00
10.168,Farmers' Market Promotion Program,timeliness,3000000.00
10.169,Specialty Crop Block Grant Program,timeliness,8422000.00
10.170,Specialty Crop Block Grant Program - Farm Bill,consistency,10000000.00,1032769.00
10.210,Food and Agricultural Sciences National Needs Graduate Fellowship Grants,consistency,3477077.00,6905000.00
10.219,Biotechnology Risk Assessment Research,consistency,1980054.00,3691363.00
10.220,Higher Education Multicultural Scholars Program,timeliness,941841.00
10.227,1994 Institutions Research Program,consistency,1434184.00,675000.00
10.308,Resident Instruction Grants for Insular Area Activities,completeness,712282.00
10.310,Agriculture and Food Research Initiative (AFRI) ,consistency,175778719.00,
10.352,Value-Added Producer Grants,consistency,19000000.00,
10.417,Very Low-Income Housing Repair Loans and Grants,consistency,30300000.00,
10.420,Rural Self-Help Housing Technical Assistance,consistency,38000000.00,66483022.00
10.433,Rural Housing Preservation Grants,consistency,9593704.00,19105513.00
10.444,Direct Housing_Natural Disaster Loans and Grants,consistency,7500.00,
10.446,Rural Community Development Initiative,consistency,8259539.00,
10.447,The Rural Development (RD) Multi-Family Housing  Revitalization Demonstration Program  (MPR),consistency,126000000.00,350929.00
10.459,Commodity Partnerships for Small Agricultural Risk Management Education Sessions,consistency,500000.00,
10.475,Cooperative Agreements with States for Intrastate Meat and Poultry Inspection,consistency,47446000.00,120308601.00
10.567,Food Distribution Program on Indian Reservations,consistency,88477000.00,32407765.00
10.574,Team Nutrition Grants,consistency,13269000.00,5768619.00
10.576,Senior Farmers Market Nutrition Program,consistency,206000000.00,1419778.00
10.582,Fresh Fruit and Vegetable Program ,consistency,40000000.00,
10.675,Urban and Community Forestry Program,consistency,25354000.00,8379259.00
10.690,Lake Tahoe Erosion Control Grant Program,consistency,8665148.00,
10.766,Community Facilities Loans and Grants,consistency,20443499.00,45623604.00
10.771,Rural Cooperative Development Grants,consistency,4900000.00,28816267.00
10.773,Rural Business Opportunity Grants,consistency,2634610.00,5732034.00
10.783,Rural Business Enterprise Grants - ARRA,consistency,54612299.00,
10.859,Assistance to High Energy Cost Rural Communities,consistency,4687415.00,11259821.00
10.862,Household Water Well System Grant Program,consistency,990000.00,50000.00
10.904,Watershed Protection and Flood Prevention,consistency,0.00,21846643.00
10.916,Watershed Rehabilitation Program,consistency,12474354.00,5966085.00
10.923,Emergency Watershed Protection Program,consistency,147393731.00,53781702.00
10.055,Direct and Counter-cyclical Payments Program,consistency,5180269955.00,240132294.00
10.448,Rural Development Multi-Family Housing Rural Housing Voucher Demonstration Program,consistency,6300000.00,
10.551,Supplemental Nutrition Assistance Program,consistency,33616777000.00,
10.566,Nutrition Assistance For Puerto Rico,consistency,1622521000.00,72930843.00
10.912,Environmental Quality Incentives Program,consistency,925990053.00,261055442.00
10.914,Wildlife Habitat Incentive Program,consistency,57106833.00,26459845.00
10.917,Agricultural Management Assistance,consistency,5756087.00,2028595.00
10.918,Ground and Surface Water Conservation_ Environmental Quality Incentives Program,consistency,0.00,15752522.00
10.920,Grassland Reserve Program,consistency,1810086.00,4053378.00
10.921,Conservation Security Program ,consistency,272461959.00,67290607.00
10.922,Healthy Forests Reserve Program (HFRP),consistency,522865.00,
10.962,Cochran Fellowship Program-International Training-Foreign Participant,consistency,1200000.00,142484.00
10.999,"Long Term Standing Agreements For Storage, Transportation And Lease",consistency,6606532.00,2129116357.00
10.051,Commodity Loans and Loan Deficiency Payments,consistency,6035694.00,11206044.00
10.077,Livestock Compensation Program,consistency,0.00,15528795.00
10.084,Dairy Market Loss Assistance Program,consistency,0.00,838809.00
10.450,Crop Insurance,completeness,3663065000.00
11.300,Investments for Public Works and Economic Development Facilities,timeliness,169919000.00
11.302,Economic Development_Support for Planning Organizations,timeliness,27985293.00
11.303,Economic Development_Technical Assistance,timeliness,10783974.00
11.307,Economic Adjustment Assistance,consistency,48051464.00,73826569.00
11.312,Research and Evaluation Program,timeliness,856141.00
11.313,Trade Adjustment Assistance for Firms,timeliness,14209654.00
11.417,Sea Grant Support,timeliness,28802725.00
11.435,Southeast Area Monitoring and Assessment Program,consistency,3716304.00,
11.554,Low-Power Television and Translator Digital-to-Analog Conversion,consistency,10000000.00,102000.00
11.555,Public Safety Interoperable Communications Grant Program,consistency,0.00,12397799.00
11.556,TV Converter Box Coupon Program,consistency,429424000.00,
11.408,Fishermen's Contingency Fund,consistency,227900.00,
12.558,"Department of Defense Impact Aid (Supplement, CWSD, BRAC)",consistency,35000000.00,
12.351,Basic  Scientific Research - Combating Weapons of Mass Destruction ,timeliness,38000000.00
12.352,Scientific Research - Combating Weapons of Mass Destruction,consistency,1000000.00,
12.360,Research on Chemical and Biological Defense,timeliness,10000000.00
12.400,"Military Construction, National Guard",consistency,101700000.00,376977600.00
12.550,The Language Flagship Grants to Institutions of Higher Education,consistency,12000000.00,
12.553,The Language Flagship Fellowships,consistency,12000000.00,
12.557,Invitational Grants for Military-Connected Schools,consistency,900000.00,
12.607,"Community Economic Adjustment Assistance for Establishment, Expansion, Realignment, or Closure of a Military Installation",timeliness,45000000.00
12.611,Community Economic Adjustment Planning Assistance for Reductions in Defense Industry Employment,consistency,2000000.00,96853.00
12.614,Community Economic Adjustment Diversification Planning,timeliness,1500000.00
12.615,RESEARCH AND TECHNICAL ASSISTANCE,consistency,1092332.00,
12.800,Air Force Defense Research Sciences Program,timeliness,365000000.00
84.403,Consolidated Grant to the Outlying Areas,consistency,72685490.00,
84.371,Striving Readers,consistency,35371080.00,
84.015,National Resource Centers Program for Foreign Language and Area Studies or Foreign Language and International Studies Program and Foreign Language and Area Studies Fellowship Program,consistency,59557652.00,0.00
84.018,Overseas Programs_Special Bilateral Projects,consistency,2149000.00,
84.021,Overseas Programs - Group Projects Abroad,consistency,4613000.00,1891294.00
84.031,Higher Education_Institutional Aid,consistency,810671193.00,264147828.00
84.042,TRIO_Student Support Services,consistency,284365000.00,270308.00
84.051,Career and Technical Education -- National Programs,consistency,7860000.00,
84.083,Women's Educational Equity Program,consistency,1846000.00,5751510.00
84.101,Career and Technical Education - Grants to Native Americans and Alaska Natives,consistency,14511000.00,0.00
84.103,TRIO Staff Training Program,consistency,4275000.00,
84.132,Centers for Independent Living,consistency,73334000.00,2826861.00
84.160,Training Interpreters for Individuals who are Deaf and Individuals who are Deaf-Blind,consistency,2084000.00,
84.165,Magnet Schools Assistance,consistency,104826000.00,
84.170,Javits Fellowships,consistency,9529558.00,4234604.00
84.184,Safe and Drug-Free Schools and Communities_National Programs,consistency,218632000.00,105497573.00
84.191,Adult Education_National Leadership Activities,consistency,6878000.00,
84.214,Even Start_Migrant Education,consistency,2050631.00,440355.00
84.217,TRIO_McNair Post-Baccalaureate Achievement,consistency,44778000.00,3014350.00
84.220,Centers for International Business Education,consistency,10960000.00,
84.229,Language Resource Centers,consistency,4949670.00,
84.245,Tribally Controlled Postsecondary Career and Technical Institutions ,consistency,7546000.00,0.00
84.246,Rehabilitation Short-Term Training,consistency,750000.00,0.00
84.256,Territories and Freely Associated States Education Grant Program,consistency,3811000.00,11571815.00
84.257,National Institute for Literacy,consistency,3906000.00,
84.258,Even Start_Indian Tribes and Tribal Organizations,consistency,954067.00,2459600.00
84.259,Native Hawaiian Career and Technical Education,consistency,2902000.00,5906052.00
84.263,Rehabilitation Training_Experimental and Innovative Training,consistency,500000.00,
84.265,Rehabilitation Training_State Vocational Rehabilitation Unit In-Service Training,consistency,5664900.00,
84.269,Institute for International Public Policy,consistency,1670301.00,4869981.00
84.274,American Overseas Research Centers,consistency,1187122.00,0.00
84.275,Rehabilitation Training_General Training,consistency,300000.00,
84.283,Comprehensive Centers,consistency,57113000.00,
84.286,Ready to Teach,consistency,10700000.00,
84.295,Ready-To-Learn Television,consistency,23831000.00,
84.304,Civic Education - We the People and the Cooperative Education Exchange Program,consistency,11861000.00,30943637.00
84.310,Parental Information and Resource Centers,consistency,38908188.00,
84.315,Capacity Building for Traditionally Underserved Populations,consistency,2288558.00,526590.00
84.329,Special Education_Studies and Evaluations,consistency,9460000.00,
84.330,Advanced Placement Program (Advanced Placement Test Fee; Advanced Placement Incentive Program Grants),consistency,43540000.00,79031301.00
84.333,"Demonstration Projects to Support Postsecondary Faculty, Staff, and Administrations in Educating Students with Disabilities",consistency,674894.00,0.00
84.334,Gaining Early Awareness and Readiness for Undergraduate Programs,consistency,303423000.00,67323628.00
84.335,Child Care Access Means Parents in School,consistency,15533799.00,31013896.00
84.336,Teacher Quality Partnership Grants,consistency,33662000.00,83501908.00
84.337,International Education_Technological Innovation and Cooperation for Foreign Information Access,consistency,1700000.00,5100000.00
84.351,Arts in Education,completeness,37533000.00
84.356,Alaska Native Educational Programs,completeness,33314645.00
84.361,Voluntary Public School Choice,consistency,25819000.00,0.00
84.363,School Leadership,consistency,14473650.00,0.00
84.370,DC School Choice Incentive Program ,consistency,14800000.00,25048400.00
84.373,Special Education_Technical Assistance on State Data Collection,consistency,15000000.00,3250000.00
84.380,Special Education -- Olympic Education Programs,completeness,11790000.00
84.381,"Baccalaureate Degrees in Science, Technology, Engineering, Mathematics, and Critical Foreign Languages and Master's Degrees in Science, Technology, Engineering, Mathematics, and Critical Foreign Languages",consistency,978000.00,1979281.00
84.382,Strengthening Minority-Serving Institutions,consistency,25000000.00,0.00
84.037,Perkins Loan Cancellations,consistency,64327000.00,
81.022,Laboratory Equipment Donation Program,consistency,26644329.00,
81.036,Inventions and Innovations,consistency,144893.00,344893.00
81.065,Nuclear Waste Disposal Siting,consistency,29000000.00,10060766.00
81.089,Fossil Energy Research and Development,consistency,400000000.00,188007775.00
81.106,"Transport of Transuranic Wastes to the Waste Isolation Pilot Plant: States and Tribal Concerns, Proposed Solutions",consistency,23610000.00,20050230.00
81.124,Predictive Science Academic Alliance Program,consistency,7500000.00,3000000.00
93.041,"Special Programs for the Aging_Title VII, Chapter 3_Programs for Prevention of Elder Abuse, Neglect, and Exploitation",consistency,5146000.00,1949902.00
93.042,"Special Programs for the Aging_Title VII, Chapter 2_Long Term Care Ombudsman Services for Older Individuals",timeliness,15421261.00
93.043,"Special Programs for the Aging_Title III, Part D_Disease Prevention and Health Promotion Services",consistency,20815881.00,
93.044,"Special Programs for the Aging_Title III, Part B_Grants for Supportive Services and Senior Centers",consistency,350595000.00,
93.045,"Special Programs for the Aging_Title III, Part C_Nutrition Services",consistency,564399000.00,1123864123.00
93.052,"National Family Caregiver Support, Title III, Part E",consistency,151904374.00,
93.053,Nutrition Services Incentive Program ,timeliness,151894688.00
93.124,Nurse Anesthetist Traineeships,timeliness,1250000.00
93.138,Protection and Advocacy for Individuals with Mental Illness,completeness,34182219.00
93.150,Projects for Assistance in Transition from Homelessness (PATH),completeness,50968000.00
93.235,Affordable Care Act (ACA) Abstinence Education Program,timeliness,27820000.00
93.264,Nurse Faculty Loan Program (NFLP),consistency,7089668.00,
93.267,State Grants for Protection and Advocacy Services,timeliness,2947590.00
93.405,ARRA - Public Health Traineeship Program,consistency,1258262.00,
93.556,Promoting Safe and Stable Families,timeliness,371221737.00
93.558,Temporary Assistance for Needy Families,timeliness,18202467000.00
93.560,Family Support Payments to States_Assistance Payments,consistency,32808000.00,
93.563,Child Support Enforcement,timeliness,4541772000.00
93.566,Refugee and Entrant Assistance_State Administered Programs,timeliness,271158000.00
93.568,Low-Income Home Energy Assistance,completeness,1980000000.00
93.569,Community Services Block Grant,timeliness,653799000.00
93.575,Child Care and Development Block Grant,consistency,2062100000.00,1953080.00
93.584,Refugee and Entrant Assistance_Targeted Assistance Grants,timeliness,43731000.00
93.586,State Court Improvement Program,completeness,32089272.00
93.590,Community-Based Child Abuse Prevention Grants,completeness,41688748.00
93.591,Family Violence Prevention and Services/Grants For Battered Women's Shelters_Grants to State Domestic Violence Coalitions,timeliness,12255200.00
93.594,Tribal Work Grants,timeliness,7558000.00
93.596,Child Care Mandatory and Matching Funds of the Child Care and Development Fund,consistency,2917000000.00,4950918946.00
93.599,Chafee Education and Training Vouchers Program (ETV),timeliness,45324389.00
93.603,Adoption Incentive Payments,timeliness,9323132.00
93.617,Voting Access for Individuals with Disabilities_Grants to States,timeliness,11817000.00
93.618,Voting Access for Individuals with Disabilities-Grants for Protection and Advocacy Systems,timeliness,4888300.00
93.630,Developmental Disabilities Basic Support and Advocacy Grants,timeliness,111506000.00
93.643,Children's Justice Grants to States,completeness,17000000.00
93.645,Stephanie Tubbs Jones Child Welfare Services Program,timeliness,281744408.00
93.658,Foster Care_Title IV-E,timeliness,4525443000.00
93.659,Adoption Assistance,timeliness,2037695794.00
93.667,Social Services Block Grant,timeliness,1700000000.00
93.669,Child Abuse and Neglect State Grants,timeliness,26535188.00
93.671,Family Violence Prevention and Services/Grants for Battered Women's Shelters_Grants to States and Indian Tribes,timeliness,98041600.00
93.674,Chafee Foster Care Independence Program,timeliness,137900000.00
93.716,ARRA  Temporary Assistance for Needy Families (TANF) Supplemental Grants ,consistency,319450000.00,
93.767,Children's Health Insurance Program,timeliness,6640000000.00
93.775,State Medicaid Fraud Control Units,consistency,186000000.00,
93.777,State Survey and Certification of Health Care Providers and Suppliers (Title XVIII) Medicare,timeliness,265204940.00
93.778,Medical Assistance Program,timeliness,211212633000.00
93.780,Grants to States for Operation of Qualified High-Risk Pools,timeliness,50000000.00
93.917,HIV Care Formula Grants,completeness,1149851230.00
93.958,Block Grants for Community Mental Health Services,timeliness,399735453.00
93.959,Block Grants for Prevention and Treatment of Substance Abuse,timeliness,1670791542.00
93.964,Public Health Traineeships,completeness,1318492.00
93.991,Preventive Health and Health Services Block Grant,completeness,91651300.00
93.994,Maternal and Child Health Services Block Grant to the States,timeliness,556580363.00
93.157,Centers of Excellence,completeness,12036127.00
93.358,Advanced Nursing Education Traineeships,timeliness,16000000.00
93.889,National Bioterrorism Hospital Preparedness Program,timeliness,398059000.00
93.230,Consolidated Knowledge Development and Application (KD&A) Program,consistency,500000.00,
93.208,Great Lakes Human Health Effects Research,completeness,1082730.00
93.206,Human Health Studies_Applied Research and Development,consistency,0.00,281943.00
93.003,Public Health and Social Services Emergency Fund,consistency,0.00,92437.00
93.009,Compassion Capital Fund  ,timeliness,52688000.00
93.010,Community-Based Abstinence Education (CBAE) ,completeness,96785000.00
93.019,Technical Assistance and Provision for Foreign Hospitals and Health Organizations,consistency,1285500.00,602000.00
93.047,"Special Programs for the Aging_Title VI, Part A, Grants to Indian Tribes_Part B, Grants to Native Hawaiians",timeliness,26134000.00
93.048,Special Programs for the Aging_Title IV_and Title II_Discretionary Projects,completeness,48618000.00
93.051,Alzheimer's Disease Demonstration Grants to States,completeness,10996505.00
93.054,"National Family Caregiver Support, Title VI, Part C, Grants To Indian Tribes And Native Hawaiians",timeliness,6268335.00
93.061,Innovations in Applied Public Health Research,completeness,27000000.00
93.063,Centers for Genomics and Public Health,completeness,700000.00
93.064,"Laboratory Training, Evaluation, and Quality Assurance Programs",completeness,2943759.00
93.065,"Laboratory Leadership, Workforce Training and Management Development, Improving Public Health Laboratory Infrastructure",consistency,12000000.00,506375.00
93.066,State Vital Statistics Improvement Program,completeness,571500.00
93.067,Global AIDS,completeness,706323427.00
93.068,"Chronic Diseases:  Research, Control, and Prevention  ",timeliness,4400000.00
93.069,Public Health Emergency Preparedness,completeness,704867418.00
93.086,Healthy Marriage Promotion and Responsible Fatherhood Grants,completeness,149949000.00
93.087,Enhance the Safety of Children Affected by Parental Methamphetamine or Other Substance Abuse,completeness,35000000.00
93.088,Advancing System Improvements to Support Targets for Healthy People 2010,completeness,4000000.00
93.103,Food and Drug Administration_Research,completeness,36823882.00
93.104,Comprehensive Community Mental Health Services for Children with Serious Emotional Disturbances (SED),timeliness,78922182.00
93.107,Area Health Education Centers Point of Service Maintenance and Enhancement Awards,timeliness,14781903.00
93.110,Maternal and Child Health Federal Consolidated Programs,completeness,131649370.00
93.113,Environmental Health,timeliness,311536000.00
93.116,Project Grants and Cooperative Agreements for Tuberculosis Control Programs,timeliness,97395976.00
93.117,Preventive Medicine Residency Program,completeness,1198894.00
93.118,Acquired Immunodeficiency Syndrome (AIDS) Activity,timeliness,3378016.00
93.123,Health Professions Pregraduate Scholarship Program for Indians,consistency,1364846.00,
93.127,Emergency Medical Services for Children,timeliness,19454000.00
93.129,Technical and Non-Financial Assistance to Health Centers,timeliness,40000000.00
93.130,Cooperative Agreements to States/Territories for the Coordination and Development of Primary Care Offices,completeness,10000000.00
93.134,Grants to Increase Organ Donations,timeliness,6066278.00
93.135,Centers for Research and Demonstration for Health Promotion and Disease Prevention,consistency,24200000.00,41607490.00
93.136,Injury Prevention and Control Research and State and Community Based Programs,timeliness,102000000.00
93.142,NIEHS Hazardous Waste Worker Health and Safety Training,timeliness,26906032.00
93.143,NIEHS Superfund Hazardous Substances_Basic Research and Education,timeliness,46452440.00
93.145,AIDS Education and Training Centers,consistency,32528024.00,114758074.00
93.153,"Coordinated Services and Access to Research for Women, Infants, Children, and Youth",timeliness,68578587.00
93.155,Rural Health Research Centers,timeliness,4208000.00
93.156,"Geriatric Training for Physicians, Dentists and Behavioral/Mental Health Professionals",completeness,6870000.00
93.181,Podiatric Residency Training in Primary Care,consistency,0.00,-4030.00
93.161,Health Program for Toxic Substances and Disease Registry,completeness,7482096.00
93.164,Indian Health Service Educational Loan Repayment,consistency,16923500.00,
93.165,Grants to States for Loan Repayment Program,completeness,6947125.00
93.172,Human Genome Research,timeliness,367716000.00
93.173,Research Related to Deafness and Communication Disorders,timeliness,395515000.00
93.178,Nursing Workforce Diversity,timeliness,15210512.00
93.184,Disabilities Prevention,consistency,16090473.00,27055603.00
93.185,"Immunization Research, Demonstration, Public Information and Education_Training and Clinical Skills Improvement Projects",consistency,19118317.00,198812993.00
93.189,Health Education Training Centers Continuing Educational Support for Health Professionals Serving in Underserved Communities ,consistency,0.00,-7294.00
93.191,Patient Navigator and Chronic Disease Prevention Program,consistency,1850754.00,3898556.00
93.192,Quentin N. Burdick Program for Rural Interdisciplinary Training,consistency,0.00,-1237978.00
93.193,Urban Indian Health Services,consistency,34547000.00,9674059.00
93.197,Childhood Lead Poisoning Prevention Projects_State and Local Childhood Lead Poisoning Prevention and Surveillance of Blood Lead Levels in Children,completeness,28093406.00
93.204,Surveillance of Hazardous Substance Emergency Events,consistency,989871.00,1832381.00
93.210,Tribal Self-Governance Program: IHS Compacts/Funding Agreements ,consistency,980000000.00,1808962.00
93.211,Telehealth Programs,completeness,6241758.00
93.212,Chiropractic Demonstration Project Grants,completeness,1817438.00
93.213,Research and Training in Complementary and Alternative Medicine,timeliness,88371000.00
93.220,Clinical Research Loan Repayment Program for Individuals from Disadvantaged Backgrounds,consistency,309000.00,
93.223,Development and Coordination of Rural Health Services,completeness,750000.00
93.224,"Consolidated Health Centers (Community Health Centers, Migrant Health Centers, Health Care for the Homeless, Public Housing Primary Care, and School Based Health Centers)",timeliness,1819000000.00
93.225,National Research Service Awards_Health Services Research Training,consistency,7820000.00,12110170.00
93.226,"Research on Healthcare Costs, Quality and Outcomes",completeness,72531331.00
93.228,Indian Health Service_Health Management Development Program,consistency,600000.00,2351071.00
93.231,Epidemiology Cooperative Agreements,consistency,6000000.00,11891216.00
