CFDA number,CFDA Program Title,Failed Metric,CFDA Program Obligation,USASpending Obligation
16.730,Reduction and Prevention of Children's Exposure to Violence,consistency,199471.00,
16.735,Protecting Inmates and Safeguarding Communities Discretionary Grant Program ,consistency,16378262.00,
16.737,Gang Resistance Education and Training,consistency,17350215.00,7581017.00
16.739,National Prison Rape Statistics Program ,consistency,2488000.00,15287175.00
16.746,Capital Case Litigation,consistency,2120957.00,600000.00
16.749,Radiation Exposure Compensation Program,consistency,31000000.00,
16.753,Congressionally Recommended Awards ,consistency,284148503.00,63531903.00
16.754,Harold Rogers Prescription Drug Monitoring Program,consistency,6063225.00,
16.607,Bulletproof Vest Partnership Program,consistency,863728.00,
16.606,State Criminal Alien Assistance Program,consistency,775402370.00,
16.571,Public Safety Officers' Benefits Program,consistency,118116071.00,
16.615,Public Safety Officers' Educational Assistance,consistency,1280006.00,
16.755,Southwest Border Prosecution Initiative Program,consistency,27505882.00,
16.814,Northern Border Prosecution Initiative Program,consistency,26374.00,
17.207,Employment Service/Wagner-Peyser Funded Activities,timeliness,773000000.00
17.225,Unemployment Insurance,consistency,46234000000.00,3312913515.00
17.259,WIA Youth Activities,timeliness,910000000.00
17.245,Trade Adjustment Assistance,timeliness,260000000.00
17.261,"WIA Pilots, Demonstrations, and Research Projects",consistency,14000000.00,43811310.00
17.265,Native American Employment and Training,timeliness,67000000.00
17.269,Community Based Job Training Grants,timeliness,123000000.00
17.270,Reintegration of Ex-Offenders,consistency,63000000.00,19641982.00
17.600,Mine Health and Safety Grants,timeliness,8441000.00
17.604,Safety and Health Grants,consistency,2161566.00,
17.807,Transition Assistance Program,consistency,6422048.00,
17.302,Longshore and Harbor Workers' Compensation,consistency,140935698.00,
17.307,Coal Mine Workers' Compensation,consistency,530437962.00,
17.310,Energy Employees Occupational Illness Compensation,consistency,1072796000.00,
15.133,Native American Business Development Institute,consistency,150000.00,
15.252,Abandoned Mine Land Reclamation (AMLR) Program,completeness,274355173.00
15.426,Coastal Impact Assistance Program (CIAP),completeness,42365455.00
15.605,Sport Fish Restoration Program,timeliness,398337729.00
15.611,Wildlife Restoration and Basic Hunter Education,timeliness,309686579.00
15.626,Enhanced Hunter Education and Safety Program,completeness,8000000.00
15.634,State Wildlife Grants,completeness,62724000.00
15.805,Assistance to State Water Resources Research Institutes,consistency,5985179.00,13310858.00
15.904,Historic Preservation Fund Grants-In-Aid,consistency,45774600.00,5784473.00
15.027,Assistance to Tribally Controlled Community Colleges and Universities,consistency,56713000.00,28060780.00
15.028,Tribally Controlled Community College Endowments,consistency,107000.00,
15.043,Indian Child and Family Education,completeness,7000000.00
15.046,Administrative Cost Grants for Indian Schools,completeness,43373000.00
15.059,Indian Graduate Student Scholarships,completeness,2164000.00
15.114,Indian Education_Higher Education Grant Program,consistency,25960000.00,
15.141,Indian Housing Assistance,completeness,13000000.00
15.144,Indian Child Welfare Act_Title II Grants,consistency,10974000.00,2995884.00
15.224,Cultural Resource Management,consistency,3350000.00,14713212.00
15.225,Recreation Resource Management,consistency,5100000.00,18972732.00
15.228,National Fire Plan - Wildland Urban Interface Community Fire Assistance,consistency,7360000.00,20595815.00
15.229,Wild Horse and Burro Resource Management,consistency,2950000.00,154000.00
15.230,Invasive and Noxious Plant Management,consistency,2800000.00,
15.231,"Fish, Wildlife and Plant Conservation Resource Management",completeness,25753000.00
15.232,Wildland Fire Research and Studies Program,consistency,230000.00,30000.00
15.233,Forests and Woodlands Resource Management,consistency,319000.00,139600.00
15.234,Secure Rural Schools and Community Self-Determination,consistency,8800000.00,
15.235,Southern Nevada Public Land Management,consistency,96000000.00,
15.236,Environmental Quality and Protection Resource Management,consistency,5762000.00,
15.237,Rangeland Resource Management,consistency,325000.00,71500.00
15.238,Challenge Cost Share,consistency,3800000.00,180550.00
15.239,Management Initiatives,consistency,2000000.00,
15.240,Helium Resource Management,consistency,6900000.00,
15.242,National Fire Plan - Rural Fire Assistance,consistency,6032000.00,2888076.00
15.250,Regulation of Surface Coal Mining and Surface Effects of Underground Coal Mining,consistency,60559.00,
15.253,Not-for-Profit AMD Reclamation,completeness,1361837.00
15.255,Applied Science Program Cooperative Agreements Related to Coal Mining and Reclamation,timeliness,1400000.00
15.421,Alaska Coastal Marine Institute,completeness,750000.00
15.422,Louisiana State University (LSU) Coastal Marine Institute  (CMI),consistency,770000.00,3278665.00
15.423,Minerals Management Service (MMS) Environmental Studies Program (ESP),consistency,900000.00,2698640.00
15.424,Marine Minerals Activities,consistency,0.00,140661.00
15.425,Offshore Research Technology Center (OTRC) Texas Engineering Experiment Station (TEES),consistency,400000.00,
15.427,Federal Oil and Gas Royalty Management,consistency,10180000.00,16743884.00
15.428,Marine Gas Hydrate Research Activities,consistency,850000.00,
15.506,Water Desalination Research and Development Program,completeness,5805000.00
15.507,WaterSMART (Sustaining and Manage America's Resources for Tomorrow),consistency,6000000.00,17278265.00
15.508,Providing Water to At-Risk Natural Desert Terminal Lakes,consistency,75000000.00,19046838.00
15.509,Colorado River Basin Salinity Control Program,consistency,11406000.00,19049171.00
15.510,Colorado Ute Indian Water Rights Settlement Act,consistency,62087000.00,
15.512,"Central Valley Project Improvement Act, Title XXXIV",consistency,10200000.00,28780107.00
15.513,Dutch John Federal Property and Disposition  Assistance Act,consistency,376000.00,916477.00
15.514,Reclamation States Emergency Drought Relief,consistency,664000.00,1334106.00
15.516,Fort Peck Reservation Rural Water System ,completeness,12370000.00
15.517,Fish and Wildlife Coordination Act,completeness,31646000.00
15.518,Garrison Diversion Unit,completeness,54837000.00
15.520,Lewis and Clark Rural Water System ,consistency,21486000.00,
15.521,Lower Rio Grande Valley Water Resources Conservation and Improvement,completeness,2519000.00
15.522,Mni Wiconi Rural Water Supply Project,completeness,42492000.00
15.523,Perkins County Rural Water System,consistency,2507050.00,6120000.00
15.524,Recreation Resources Management,consistency,7114000.00,110151830.00
15.525,Rocky Boy's/North Central Montana Regional Water System,consistency,72994.00,11408030.00
15.526,San Gabriel Basin Restoration Project,consistency,400000.00,1249468.00
15.528,St. Mary Storage Unit Facilities Rehabilitation Project,consistency,343845.00,
15.529,Upper Colorado and San Juan River Basins Endangered Fish Recovery Programs,consistency,1600000.00,3139635.00
15.530,Water Conservation Field Services Program (WCFSP),consistency,14340000.00,
15.531,Yakima River Basin Water Enhancement Project (YRBWEP),completeness,4120000.00
15.532,"Central Valley Project, Trinity River Division, Trinity River  Fish and Wildlife Management",consistency,1357000.00,3635958.00
15.533,California Water Security and Environmental Enhancement,consistency,27000.00,435104.00
15.534,"Miscellaneous Public Law 93-638 Contracts, Grants, and Cooperative Agreements",consistency,0.00,500000.00
15.535,Upper Colorado River Basin Fish and Wildlife Mitigation Program.,consistency,24000.00,
15.540,Lake Mead/Las Vegas Wash Program,consistency,2342573.00,
15.614,"Coastal Wetlands Planning, Protection and Restoration Act",timeliness,20575000.00
15.615,Cooperative Endangered Species Conservation Fund,completeness,73831000.00
15.616,Clean Vessel Act,completeness,13250000.00
15.619,Rhinoceros and Tiger Conservation Fund,consistency,1822000.00,891158.00
15.620,African Elephant Conservation Fund,consistency,1386000.00,
15.621,Asian Elephant Conservation Fund,timeliness,1429000.00
15.622,Sportfishing and Boating Safety Act,timeliness,13400000.00
15.623,North American Wetlands Conservation Fund,consistency,83500000.00,39284086.00
15.628,Multistate Conservation Grant Program,timeliness,6000000.00
15.629,Great Apes Conservation Fund,consistency,1686000.00,4567109.00
15.635,Neotropical Migratory Bird Conservation ,consistency,4296906.00,1641041.00
15.636,Alaska Subsistence Management,timeliness,5075000.00
15.637,Migratory Bird Joint Ventures,completeness,4067545.00
15.639,Tribal Wildlife Grants Program,consistency,6000000.00,
15.640,Wildlife Without Borders- Latin America and the Caribbean ,consistency,947000.00,
15.641,Wildlife Without Borders-Mexico ,consistency,752000.00,101000.00
15.643,Alaska Migratory Bird Co-Management Council,completeness,222600.00
15.645,Marine Turtle Conservation Fund,completeness,906000.00
15.647,Migratory  Bird Conservation,completeness,365800.00
15.649,Service Training and Technical Assistance (Generic Training),consistency,91000.00,497195.00
15.650,Research Grants (Generic),consistency,50000.00,
15.651,Wildlife Without Borders-Africa Program,completeness,500000.00
15.653,National Outreach and Communication Program,consistency,13400000.00,12000.00
15.655,"Migratory Bird Monitoring, Assessment and Conservation",consistency,2205000.00,697267.00
15.807,Earthquake Hazards Reduction Program,consistency,13138000.00,20040777.00
15.808,U.S. Geological Survey_ Research and Data Collection,completeness,41000000.00
15.810,National Cooperative Geologic Mapping Program,consistency,6981655.00,
15.811,Gap Analysis Program  ,consistency,2100000.00,4032128.00
15.812,Cooperative Research Units Program ,timeliness,16000000.00
15.813,Cooperative Research Units Training Program,timeliness,1500000.00
15.814,National Geological and Geophysical Data Preservation Program,consistency,500000.00,
15.815,National Land Remote Sensing_Education Outreach and Research,consistency,960000.00,
15.816,Minerals Resources External Research Program,consistency,115478.00,
15.875,"Economic, Social, and Political Development of the Territories",timeliness,223475000.00
15.916,"Outdoor Recreation_Acquisition, Development and Planning",consistency,23133400.00,35240967.00
15.922,Native American Graves Protection and Repatriation Act,consistency,2400000.00,
15.923,National Center for Preservation Technology and Training,consistency,165415.00,
15.926,American Battlefield Protection,consistency,1367144.00,172320.00
15.928,Civil War Battlefield Land Acquisition Grants,consistency,3000000.00,
15.929,Save America's Treasures,consistency,24610000.00,1402600.00
15.930,Chesapeake Bay Gateways Network,consistency,550000.00,
15.931,Conservation Activities by Youth Service Organizations,consistency,10400000.00,3750264.00
15.936,Shenandoah Valley Battlefields National Historic District Battlefield Acquisition and Protection,consistency,1665488.00,
15.978,Upper Mississippi River System Long Term Resource Monitoring Program,consistency,2691425.00,4573213.00
15.658,"Natural Resource Damage Assessment, Restoration and Implementation",consistency,5200000.00,
15.020,Aid To Tribal Governments,consistency,33887000.00,
15.021,Consolidated Tribal Government Program,consistency,69240000.00,18420346.00
15.022,Tribal Self-Governance,consistency,389500000.00,58215196.00
15.024,Indian Self-Determination Contract Support,consistency,149628000.00,51820813.00
15.025,"Services to Indian Children, Elderly and Families",consistency,21690000.00,5104514.00
15.026,Indian Adult Education,consistency,2434000.00,596602.00
15.029,Tribal Courts,consistency,11604200.00,4592699.00
15.031,Indian Community Fire Protection,completeness,948000.00
15.032,Indian Economic Development,completeness,1477230.00
15.033,Road Maintenance_Indian Roads,completeness,7014870.00
15.034,Agriculture on Indian Lands,completeness,3659250.00
15.035,Forestry on Indian Lands,consistency,14500000.00,5864330.00
15.036,Indian Rights Protection,completeness,415910.00
15.037,Water Resources on Indian Lands,completeness,4996195.00
15.038,Minerals and Mining on Indian Lands,completeness,1000000.00
15.040,Real Estate Programs_Indian Lands,consistency,3987550.00,
15.041,Environmental Management_Indian Programs,consistency,4000000.00,400554.00
15.042,Indian School Equalization Program,completeness,221765000.00
15.044,Indian Schools_Student Transportation,completeness,31970600.00
15.045,Assistance for Indian Children with Severe Disabilities,completeness,371500.00
15.047,"Indian Education Facilities, Operations, and Maintenance",consistency,59800000.00,4593646.00
15.048,Bureau of Indian Affairs Facilities_Operations and Maintenance,consistency,1440670.00,34756300.00
15.051,Endangered Species on Indian Lands,consistency,1217000.00,552500.00
15.052,Litigation Support for Indian Rights,completeness,1386000.00
15.053,Attorney Fees_Indian Rights,completeness,1764000.00
15.057,Navajo-Hopi Indian Settlement Program,completeness,239200.00
15.062,Replacement and Repair of Indian Schools,consistency,69129220.00,27138922.00
15.063,Improvement and Repair of Indian Detention Facilities,consistency,9999900.00,4583547.00
15.064,Structural Fire Protection_Bureau of Indian Affairs Facilities,consistency,532960.00,40692.00
15.065,Safety of Dams on Indian Lands,consistency,6700000.00,3239262.00
15.108,Indian Employment Assistance,consistency,6923860.00,1925112.00
15.113,Indian Social Services_Welfare Assistance,consistency,59332460.00,26414711.00
15.130,Indian Education_Assistance to Schools,consistency,13781000.00,
15.148,Tribal Energy Development Capacity Grants,consistency,1000000.00,
15.254,Summer Intern and Year-Long OSM/VISTA Watershed Support,consistency,30000.00,107000.00
15.630,Coastal Program,consistency,11500000.00,
15.631,Partners for Fish and Wildlife,consistency,42600000.00,13804360.00
15.644,Federal Junior Duck Stamp Conservation and Design ,consistency,150000.00,2966.00
15.659,National Wildlife Refuge Fund,consistency,23303945.00,
15.060,Indian Vocational Training_United Tribes Technical College,consistency,4000.00,
21.006,Tax Counseling for the Elderly,consistency,4065415.00,
21.008,Low Income Taxpayer Clinics,consistency,9000000.00,
21.009,Volunteer Income Tax Assistance (VITA) Matching Grant Program,consistency,8000000.00,
21.020,Community Development Financial Institutions Program,consistency,44794749.00,117176939.00
21.021,Bank Enterprise Award Program,timeliness,20101901.00
20.205,Highway Planning and Construction,timeliness,40068000000.00
20.218,National Motor Carrier Safety,consistency,202000000.00,
20.231,Performance and Registration Information Systems Management,consistency,5000000.00,
20.505,Metropolitan Transportation Planning,consistency,73845000.00,130985142.00
20.513,Capital Assistance Program for Elderly Persons and Persons with Disabilities,completeness,117242000.00
20.515,State Planning and Research,consistency,16944400.00,
20.521,New Freedom Program,consistency,199741308.00,90499449.00
20.600,State and Community Highway Safety,timeliness,224870000.00
20.700,Pipeline Safety Program Base Grants,timeliness,19500000.00
20.106,Airport Improvement Program,timeliness,3310112000.00
20.109,Air Transportation Centers of Excellence,timeliness,8500000.00
20.215,Highway Training and Education,consistency,13451420.00,
20.232,Commercial Driver's License Program Improvement Grant,consistency,25000000.00,
20.234,Safety Data Improvement Program,completeness,30000000.00
20.237,Commercial Vehicle Information Systems and Networks,consistency,22500000.00,7846550.00
20.238,Commercial Drivers License Information System (CDLIS) Modernization Grant,timeliness,8000000.00
20.240,Fuel Tax Evasion-Intergovernmental Enforcement Effort,consistency,1000000.00,
20.313,Railroad Research and Development,consistency,2875000.00,
20.314,Railroad Development,consistency,37139300.00,1485000.00
20.514,Public Transportation Research,completeness,84752900.00
20.516,Job Access_Reverse Commute,completeness,157346731.00
20.518,Capital and Training Assistance Program for Over-the-Road Bus Accessibility,consistency,1090620.00,319426.00
20.519,Clean Fuels,completeness,21714447.00
20.520,Paul S. Sarbanes Transit in the Parks,consistency,24875000.00,5590053.00
20.522,Alternatives Analysis ,timeliness,27794000.00
20.601,Alcohol Impaired Driving Countermeasures Incentive Grants I,completeness,130500000.00
20.602,Occupant Protection Incentive Grants,timeliness,25000000.00
20.607,Alcohol Open Container Requirements,timeliness,132635202.00
20.608,Minimum Penalties for Repeat Offenders for Driving While Intoxicated,timeliness,132635202.00
20.609,Safety Belt Performance Grants,timeliness,69807597.00
20.610,State Traffic Safety Information System Improvement Grants,completeness,34500000.00
20.611,Incentive Grant Program to Prohibit Racial Profiling,completeness,2725020.00
20.612,Incentive Grant Program to Increase Motorcyclist Safety,completeness,6000000.00
20.613,Child Safety and Child Booster Seats Incentive Grants,completeness,6000000.00
20.614,National Highway Traffic Safety Administration (NHTSA) Discretionary Safety Grants ,consistency,40000000.00,7117757.00
20.701,University Transportation Centers Program,timeliness,83400000.00
20.703,Interagency Hazardous Materials Public Sector Training and Planning Grants,consistency,26800000.00,
20.704,RITA Hydrogen,consistency,495000.00,
20.720,State Damage Prevention Program Grants,timeliness,1327497.00
20.721,PHMSA Pipeline Safety Program One Call Grant,consistency,1043000.00,
20.761,Biobased Transportation Research,consistency,12840435.00,
20.815,Fireboat Construction,consistency,993500.00,
20.762,Research Grants,timeliness,1000000.00
20.763,Research and Innovative Technology (RIT) Hydrogen Alternative Fuel Life Cycle,consistency,738294.00,
20.764,Hydrogen Storage Research and Development,consistency,730000.00,
20.910,Assistance to small and disadvantaged businesses,consistency,1352547000.00,1405094.00
20.930,Payments for Small Community Air Service Development,consistency,10000000.00,
20.239,Motor Carrier Research and Technology Programs,consistency,3000000.00,
20.301,Railroad Safety,consistency,104000000.00,
20.806,State Maritime Schools,consistency,13181000.00,
20.813,Maritime Security Fleet Program,consistency,156000000.00,
20.803,Maritime War Risk Insurance,consistency,154000.00,
64.014,Veterans State Domiciliary Care,consistency,49339000.00,
64.015,Veterans State Nursing Home Care,consistency,501046000.00,
64.016,Veterans State Hospital Care,consistency,3346000.00,
64.005,Grants to States for Construction of State Home Facilities,timeliness,161782000.00
64.024,VA Homeless Providers Grant and Per Diem Program,consistency,107180000.00,50849285.00
64.026,Veterans State Adult Day Health Care,consistency,380000.00,
64.203,State Cemetery Grants,timeliness,36937000.00
64.100,Automobiles and Adaptive Equipment for Certain Disabled Veterans and Members of the Armed Forces,consistency,57300000.00,
64.101,Burial Expenses Allowance for Veterans,consistency,195949000.00,
64.106,Specially Adapted Housing for Disabled Veterans,consistency,35910000.00,
64.117,Survivors and Dependents Educational Assistance,consistency,450646000.00,
64.120,Post-Vietnam Era Veterans' Educational Assistance,consistency,2256000.00,
64.202,Procurement of Headstones and Markers and/or Presidential Memorial Certificates,consistency,52761000.00,
64.104,Pension for Non-Service-Connected Disability for Veterans,consistency,2858181000.00,
64.105,"Pension to Veterans Surviving Spouses, and Children",consistency,896414000.00,
64.109,Veterans Compensation for Service-Connected Disability,consistency,32456880000.00,
64.116,Vocational Rehabilitation for Disabled Veterans,consistency,622948000.00,
64.124,All-Volunteer Force Educational Assistance,consistency,2164929000.00,
64.127,Monthly Allowance for Children of Vietnam Veterans Born with Spina Bifida,consistency,18706000.00,
66.432,State Public Water System Supervision,timeliness,97554000.00
66.433,State Underground Water Source Protection,timeliness,10727000.00
66.454,Water Quality Management Planning,completeness,8607444.00
66.460,Nonpoint Source Implementation Grants,timeliness,200857000.00
66.472,Beach Monitoring and Notification Program Implementation Grants,completeness,9746000.00
66.605,Performance Partnership Grants,timeliness,392000000.00
66.001,Air Pollution Control Program Support,consistency,165049417.00,79059892.00
66.032,State Indoor Radon Grants,completeness,7948000.00
66.033,Ozone Transport Commission,consistency,635000.00,
66.034,"Surveys, Studies, Research, Investigations, Demonstrations, and Special Purpose Activities Relating to the Clean Air Act",consistency,18001650.00,69302023.00
66.035,Community Action for a Renewed Environment (CARE) Program,timeliness,3400000.00
66.036,Clean School Bus USA,consistency,0.00,6847751.00
66.037,"Internships, Training and Workshops for the Office of Air and Radiation",consistency,8611.00,108910.00
66.038,"Training, Investigations, and Special Purpose Activities of Federally-Recognized Indian Tribes Consistent With the Clean Air Act (CAA), Tribal Sovereignty and the Protection and Management of Air Quality",consistency,9589688.00,3392040.00
66.039,National Clean Diesel Emissions Reduction Program,consistency,34400000.00,6018558.00
66.111,Regional Environmental Priority Projects,consistency,300000.00,257300.00
66.117,Region 9 Multi-Media and Geographic Priority Projects,consistency,463000.00,26000.00
66.119,West Coast Estuaries Initiative,consistency,2800000.00,
66.202,Congressionally Mandated Projects,timeliness,202246000.00
66.203,Environmental Finance Center Grants,consistency,2000000.00,
66.305,Compliance Assistance Support for Services to the Regulated Community and Other Assistance Providers ,consistency,780000.00,1195929.00
66.310,Capacity Building Grants and Cooperative Agreements for Compliance Assurance and Enforcement Activities in Indian Country and Other Tribal Areas,consistency,1095000.00,130000.00
66.418,Construction Grants for Wastewater Treatment Works,consistency,5083000.00,8454538.00
66.424,"Surveys, Studies, Investigations, Demonstrations, and Training Grants - Section 1442 of the Safe Drinking Water Act",timeliness,9098778.00
66.436,"Surveys, Studies, Investigations, Demonstrations, and Training Grants and Cooperative Agreements - Section 104(b)(3) of the Clean Water Act",consistency,1178402.00,49066767.00
66.439,Targeted Watersheds Grants,timeliness,20000000.00
66.461,Regional Wetland Program Development Grants,timeliness,15829000.00
66.462,National Wetland Program Development Grants and Five-Star Restoration Training Grant,consistency,0.00,519963.00
66.466,Chesapeake Bay Program,timeliness,24844000.00
66.467,Wastewater Operator Training Grant Program,consistency,0.00,477490.00
66.469,Great Lakes Program,consistency,40556000.00,6603944.00
66.473,Direct Implementation Tribal Cooperative Agreements,consistency,700000.00,2288635.00
66.475,Gulf of Mexico Program,consistency,3325000.00,1440704.00
66.478,Water Security Training and Technical Assistance and Water Security Initiative Contamination Warning System Pilots,timeliness,20119149.00
66.479,Wetland Program Grants -  State/Tribal Environmental Outcome Wetland Demonstration Program,consistency,0.00,1731575.00
66.480,Assessment and Watershed Protection Program Grants ,consistency,500000.00,160000.00
66.481,Lake Champlain Basin Program,timeliness,2707000.00
66.509,Science To Achieve Results (STAR) Research Program,timeliness,52500000.00
66.511,Office of Research and Development Consolidated Research/Training/Fellowships,consistency,33600000.00,10458721.00
66.512,Regional Environmental Monitoring and Assessment Program (REMAP) Research Projects,timeliness,767500.00
66.513,Greater Research Opportunities (GRO) Fellowships For Undergraduate Environmental Study,consistency,1529000.00,
66.514,Science To Achieve Results (STAR) Fellowship Program ,consistency,7200000.00,
66.516,P3 Award: National Student Design Competition for Sustainability,timeliness,1077000.00
66.517,Regional Applied Research Efforts (RARE) ,consistency,511000.00,
66.518,State Senior Environmental Employment Program,consistency,350000.00,
66.600,Environmental Protection Consolidated Grants for the Insular Areas - Program Support,completeness,6603700.00
66.604,Environmental Justice Small Grant Program ,consistency,800000.00,50000.00
66.609,Protection of Children and Older Adults (Elderly) from Environmental Health Risks,timeliness,600000.00
66.610,"Surveys, Studies, Investigations and Special Purpose Grants within the Office of the Administrator",consistency,500000.00,173770.00
66.612,"Surveys, Studies, Investigations, Training Demonstrations and Educational Outreach Related to Environmental Information and the Release of Toxic Chemicals  ",consistency,225000.00,
66.707,TSCA Title IV State Lead Grants Certification of Lead-Based Paint Professionals,completeness,13564000.00
66.709,Multi-Media Capacity Building Grants for States and Tribes,timeliness,1209000.00
66.714,Pesticide Environmental Stewardship Regional Grants ,consistency,497200.00,1051832.00
66.716,"Research, Development, Monitoring, Public Education, Training, Demonstrations, and Studies",timeliness,5549300.00
66.717,Source Reduction Assistance,completeness,1600000.00
