CFDA number,CFDA Program Title,Failed Metric,CFDA Program Obligation,USASpending Obligation
93.232,Loan Repayment Program for General Research,consistency,4409000.00,
93.233,National Center on Sleep Disorders Research,completeness,39222000.00
93.234,Traumatic Brain Injury State Demonstration Grant Program,timeliness,5313161.00
93.236,Grants for Dental Public Health Residency Training,timeliness,5093496.00
93.237,Special Diabetes Program for Indians_Diabetes Prevention and Treatment  Projects,completeness,112300000.00
93.240,State Capacity Building,completeness,12681515.00
93.241,State Rural Hospital Flexibility Program,completeness,47100000.00
93.242,Mental Health Research Grants,timeliness,969462000.00
93.243,Substance Abuse and Mental Health Services_Projects of Regional and National Significance,completeness,351705645.00
93.247,Advanced Nursing Education Grant Program ,timeliness,40697432.00
93.249,Public Health Training Centers Grant Program,timeliness,4500000.00
93.251,Universal Newborn Hearing Screening,timeliness,10189000.00
93.253,Poison Center Support and Enhancement Grant Program,completeness,22605223.00
93.254,Infant Adoption Awareness Training,completeness,12453000.00
93.257,"Grants for Education, Prevention, and Early Detection of Radiogenic Cancers and Diseases",timeliness,1517930.00
93.259,Rural Access to Emergency Devices Grant,consistency,1100000.00,229531.00
93.262,Occupational Safety and Health Program,consistency,89181333.00,143860358.00
93.265,Comprehensive Geriatric Education Program(CGEP),completeness,3333000.00
93.266,Rapid Expansion of Antiretroviral Therapy Programs for HIV-Infected Persons in Selected Countries in Africa and the Caribbean Under the President's Emergency Plan for AIDS Relief,completeness,214000000.00
93.268,Immunization Grants,consistency,2952502996.00,348750078.00
93.269,Complex Humanitarian Emergency and War-Related Injury Public Health Activities,consistency,0.00,3061400.00
93.270,Adult Viral Hepatitis Prevention and Control,consistency,9500000.00,
93.271,Alcohol Research Career Development Awards for Scientists and Clinicians,completeness,12051000.00
93.272,Alcohol National Research Service Awards for Research Training,timeliness,11284000.00
93.273,Alcohol Research Programs,timeliness,282030000.00
93.275,Substance Abuse and Mental Health Services-Access to Recovery,completeness,95962645.00
93.276,Drug-Free Communities Support Program Grants,completeness,82361304.00
93.279,Drug Abuse and Addiction Research Programs,consistency,38611000.00,707806491.00
93.281,Mental Health Research Career/Scientist Development Awards,timeliness,70480000.00
93.282,Mental Health National Research Service Awards for Research Training,timeliness,49858000.00
93.283,Centers for Disease Control and Prevention_Investigations and Technical Assistance,consistency,131589465.00,904983808.00
93.284,Injury Prevention Program for American Indians and Alaskan Natives_Cooperative Agreements,completeness,1400000.00
93.286,Discovery and Applied Research for Technological Innovations to Improve Human Health,timeliness,300463000.00
93.296,State Partnership Grant Program to Improve Minority Health ,consistency,4979018.00,
93.300,National Center for Health Workforce Analysis,completeness,750000.00
93.301,Small Rural Hospital Improvement Grant Program,completeness,14220000.00
93.307,Minority Health and Health Disparities Research ,timeliness,149973000.00
93.310,Trans-NIH Research Support,consistency,453000000.00,208641358.00
93.359,"Nurse Education, Practice and Retention Grants",timeliness,34662183.00
93.361,Nursing Research,timeliness,120687000.00
93.392,Cancer Construction,consistency,0.00,6496462.00
93.365,Sickle Cell Treatment Demonstration Program,completeness,1469216.00
93.389,National Center for Research Resources,timeliness,1470334000.00
93.393,Cancer Cause and Prevention Research,timeliness,1301623000.00
93.394,Cancer Detection and Diagnosis Research,consistency,517390000.00,246817660.00
93.395,Cancer Treatment Research,timeliness,539691000.00
93.396,Cancer Biology Research,timeliness,503739000.00
93.397,Cancer Centers Support Grants,completeness,479564000.00
93.398,Cancer Research Manpower,timeliness,180965000.00
93.399,Cancer Control,completeness,190442000.00
93.403,ARRA Grants for Training in Primary Care Medicine and Dentistry Training and Enhancement,consistency,43872255.00,
93.404,ARRA  Dental Public Health Residency Training Grants,consistency,481316.00,
93.407,ARRA - Scholarships for Disadvantaged Students,consistency,42400000.00,
93.410,ARRA  Licensure Portability Grant Program,consistency,700000.00,
93.412,ARRA - Preventive Medicine Residency Program,consistency,1198894.00,
93.415,ARRA - Centers of Excellence,consistency,12036127.00,
93.416,ARRA - Health Careers Opportunity Program,consistency,9282051.00,
93.417,ARRA - Nursing Workforce Diversity,consistency,14689000.00,
93.442,Special Diabetes Program for Indians (SDPI) Competitive Grant Program,consistency,23300000.00,
93.443,Health Promotion/Disease Prevention Program for American Indians and Alaska Natives ,consistency,1300000.00,2065236.00
93.444,Tribal Self-Governance Program: Planning and Negotiation Cooperative Agreement,consistency,600000.00,
93.550,Transitional Living for Homeless Youth,timeliness,43268000.00
93.551,Abandoned Infants,completeness,11628000.00
93.557,"Education and Prevention Grants to Reduce Sexual Abuse of Runaway, Homeless and Street Youth",completeness,17221000.00
93.564,Child Support Enforcement Research,completeness,1800000.00
93.570,Community Services Block Grant_Discretionary Awards,completeness,39326000.00
93.576,Refugee and Entrant Assistance_Discretionary Grants,timeliness,76492000.00
93.579,U.S. Repatriation,completeness,1000000.00
93.581,Improving the Capability of Indian Tribal Governments to Regulate Environmental Quality,completeness,1985326.00
93.583,Refugee and Entrant Assistance_Wilson/Fish Program,completeness,23000000.00
93.587,Promote the Survival and Continuing Vitality of Native American Languages,completeness,7865912.00
93.592,Family Violence Prevention and Services/Grants for Battered Women's Shelters_Discretionary Grants,completeness,12645598.00
93.593,Job Opportunities for Low-Income Individuals,completeness,5288000.00
93.595,"Welfare Reform Research, Evaluations and National Studies",consistency,41981036.00,1786082.00
93.597,Grants to States for Access and Visitation Programs,timeliness,10000000.00
93.598,Services to Victims of a Severe Form of Trafficking,timeliness,3381323.00
93.785,Pilot Program for National and State Background Checks--Direct Patient Access for Long-Term Care,consistency,1184000.00,
93.600,Head Start,timeliness,6877975000.00
93.601,Child Support Enforcement Demonstrations and Special Projects,timeliness,1246000.00
93.602,Assets for Independence Demonstration Program,timeliness,24023000.00
93.604,Assistance for Torture Victims,completeness,9577000.00
93.612,Native American Programs,completeness,27456742.00
93.616,Mentoring Children of Prisoners,completeness,50848000.00
93.623,Basic Center Grant,completeness,52860000.00
93.631,Developmental Disabilities Projects of National Significance,completeness,14162000.00
93.632,"University Centers for Excellence in Developmental Disabilities Education, Research, and Service",timeliness,36440000.00
93.647,Social Services Research and Demonstration,timeliness,20937130.00
93.648,Child Welfare Research Training or Demonstration ,completeness,7206858.00
93.652,Adoption Opportunities,completeness,26379000.00
93.670,Child Abuse and Neglect Discretionary Activities,completeness,37128542.00
93.676,Unaccompanied Alien Children Program,completeness,91685000.00
93.760,Rural PACE (Program of All-Inclusive Care for the Elderly) Provider Grant Program,consistency,5000000.00,-4.00
93.776,Hurricane Katrina Relief,consistency,19064378.00,
93.768,Medicaid Infrastructure Grants To Support the Competitive Employment of People with Disabilities,timeliness,43028057.00
93.769,Demonstration to Maintain Independence and Employment,timeliness,4257179.00
93.779,"Centers for Medicare and Medicaid Services (CMS) Research, Demonstrations and Evaluations",consistency,31301000.00,85412115.00
93.789,Alternatives to Psychiatric Residential Treatment Facilities for Children,completeness,8413995.00
93.790,Alternate Non-Emergency Service Providers or Networks,timeliness,25979199.00
93.791,Money Follows the Person Rebalancing Demonstration ,completeness,130518753.00
93.793,Medicaid Transformation Grants,timeliness,75000000.00
93.822,Health Careers Opportunity Program,timeliness,9282051.00
93.824,Area Health Education Centers Infrastructure Development Awards,timeliness,12862217.00
93.837,Cardiovascular Diseases Research,timeliness,1353709000.00
93.838,Lung Diseases Research,timeliness,553973000.00
93.839,Blood Diseases and Resources Research,timeliness,406074000.00
93.846,"Arthritis, Musculoskeletal and Skin Diseases Research",timeliness,396924000.00
93.847,"Diabetes, Digestive, and Kidney Diseases Extramural Research",timeliness,1221925000.00
93.853,Extramural Research Programs in the Neurosciences and Neurological Disorders,consistency,2781070000.00,1251752718.00
93.855,"Allergy, Immunology and Transplantation Research",consistency,616475000.00,2156176083.00
93.856,Microbiology and Infectious Diseases Research,consistency,2067013000.00,47184717.00
93.859,Biomedical Research and Research Training,timeliness,1865006000.00
93.865,Child Health and Human Development Extramural Research,consistency,1788340000.00,686601944.00
93.866,Aging Research,timeliness,879098000.00
93.867,Vision Research,timeliness,537321000.00
93.879,Medical Library Assistance,completeness,65294000.00
93.884,Grants for Training in Primary Care Medicine and Dentistry,timeliness,44237784.00
93.887,Health Care and Other Facilities,timeliness,248000000.00
93.888,Specially Selected Health Projects,consistency,28159003.00,54399073.00
93.891,Alcohol Research Center Grants,consistency,27276000.00,8279619.00
93.912,"Rural Health Care Services Outreach, Rural Health Network Development and Small Health Care Provider  Quality Improvement Program ",timeliness,35154966.00
93.913,Grants to States for Operation of Offices of Rural Health,completeness,7670000.00
93.914,HIV Emergency Relief Project Grants,completeness,601207157.00
93.918,Grants to Provide Outpatient Early Intervention Services with Respect to HIV Disease,completeness,186606136.00
93.919,Cooperative Agreements for State-Based Comprehensive Breast and Cervical Cancer Early Detection Programs,consistency,157076794.00,
93.923,Disadvantaged Health Professions Faculty Loan Repayment (FLRP) and Minority Faculty Fellowship Program (MFFP),consistency,1188318.00,447333.00
93.924,Ryan White HIV/AIDS Dental Reimbursements Community Based Dental Partnership,consistency,12263731.00,2842066.00
93.925,Scholarships for Health Professions Students from Disadvantaged Backgrounds,timeliness,42420564.00
93.926,Healthy Start Initiative,completeness,99744481.00
93.928,Special Projects of National Significance,timeliness,25000000.00
93.932,Native Hawaiian Health Systems,consistency,125450000.00,13068000.00
93.936,National Institutes of Health Acquired Immunodeficiency Syndrome Research Loan Repayment Program,consistency,329000.00,
93.938,Cooperative Agreements to Support Comprehensive School Health Programs to Prevent the Spread of HIV and Other Important Health Problems,consistency,35593573.00,62091137.00
93.939,HIV Prevention Activities_Non-Governmental Organization Based,timeliness,77501379.00
93.940,HIV Prevention Activities_Health Department Based,consistency,327098892.00,496178058.00
93.941,"HIV Demonstration, Research, Public and Professional Education Projects",consistency,14945541.00,541254092.00
93.942,"Research, Treatment and Education Programs on Lyme Disease in the United States",timeliness,1400494.00
93.943,Epidemiologic Research Studies of Acquired Immunodeficiency Syndrome (AIDS) and Human Immunodeficiency Virus (HIV) Infection in Selected Population Groups,consistency,4483640.00,147254753.00
93.944,Human Immunodeficiency Virus (HIV)/Acquired Immunodeficiency Virus Syndrome (AIDS) Surveillance,timeliness,76044582.00
93.945,Assistance Programs for Chronic Disease Prevention and Control,completeness,50502222.00
93.946,Cooperative Agreements to Support State-Based Safe Motherhood and Infant Health Initiative Programs,consistency,5200000.00,18384844.00
93.947,"Tuberculosis Demonstration, Research, Public and Professional Education",completeness,542683.00
93.965,Coal Miners Respiratory Impairment Treatment Clinics and Services,completeness,5600000.00
93.970,Health Professions Recruitment Program for Indians,consistency,0.00,2709454.00
93.972,Health Professions Scholarship Program,consistency,9603857.00,
93.977,Preventive Health Services_Sexually Transmitted Diseases Control Grants,consistency,104700730.00,186574113.00
93.978,"Preventive Health Services_Sexually Transmitted Diseases Research, Demonstrations, and Public Information and Education Grants",consistency,4685883.00,7880762.00
93.982,Mental Health Disaster Assistance and Emergency Mental Health,timeliness,38667953.00
93.989,International Research and Research Training,timeliness,50100000.00
93.250,Geriatric Academic Career Awards,consistency,6418000.00,
93.162,National Health Service Corps Loan Repayment Program,consistency,59647676.00,
93.209,Contraception and Infertility Research Loan Repayment Program,consistency,1000000.00,
93.255,Children's Hospitals Graduate Medical Education Payment,consistency,297000000.00,
93.280,National Institutes of Health Loan Repayment Program for Clinical Researchers,consistency,38593631.00,
93.285,National Institutes of Health Pediatric Research Loan Repayment Program,consistency,17406844.00,
93.288,National Health Service Corps Scholarship Program,consistency,14679266.00,
93.303,Nursing Scholarship Program,consistency,14000000.00,
93.400,National Health Service Corps Scholarship Program,consistency,13786032.00,
93.401,ARRA - National Health Service Corps Loan Repayment ,consistency,59647676.00,
93.406,Nursing Education Loan Repayment Program (NELRP),consistency,18901576.00,
93.409,Faculty Loan Repayment Programs,consistency,1133841.00,
93.441,Indian Self-Determination,consistency,509600000.00,6479.00
93.770,Medicare_Prescription Drug Coverage,consistency,43740793000.00,13707113331.00
93.773,Medicare_Hospital Insurance,completeness,223304091000.00
93.774,Medicare_Supplementary Medical Insurance,completeness,187255712000.00
93.784,Federal Reimbursement of Emergency Health Services Furnished to Undocumented Aliens,consistency,206000000.00,
93.908,Nursing Education Loan Repayment Program ,consistency,18901576.00,
97.008,Non-Profit Security Program,consistency,862925000.00,15050738.00
97.012,Boating Safety Financial Assistance,completeness,128384934.00
97.024,Emergency Food and Shelter National Board Program,consistency,153000135.00,
97.042,Emergency Management Performance Grants,consistency,291450000.00,597472500.00
97.073,State Homeland Security Program (SHSP),consistency,921500000.00,
97.010,Citizenship Education and Training,consistency,450000.00,
97.023,Community Assistance Program State Support Services Element (CAP-SSSE),consistency,7637500.00,
97.025,National Urban Search and Rescue (US&R) Response System,consistency,28982012.00,
97.029,Flood Mitigation Assistance,consistency,41000000.00,
97.032,Crisis Counseling,consistency,13828309.00,
97.036,Disaster Grants - Public Assistance (Presidentially Declared Disasters),consistency,3124128957.00,
97.039,Hazard Mitigation Grant,consistency,1015000000.00,
97.040,Chemical Stockpile Emergency Preparedness Program,consistency,73900000.00,
97.041,National Dam Safety Program,consistency,3212000.00,
97.043,State Fire Training Systems Grants,consistency,1400000.00,
97.044,Assistance to Firefighters Grant,consistency,560000000.00,
97.045,Cooperating Technical Partners,consistency,62300000.00,
97.046,Fire Management Assistance Grant,consistency,110000000.00,
97.047,Pre-Disaster Mitigation,consistency,114000000.00,
97.048,Federal Disaster Assistance to Individuals and Households in Presidential Declared Disaster Areas,consistency,364673014.00,
97.053,Citizen Corps,consistency,14572500.00,805000.00
97.066,"Homeland Security Information Technology Research, Testing, Evaluation and Demonstration Program",consistency,10100000.00,
97.069,Aviation Research Grants,consistency,9691029.00,
97.071,Metropolitan Medical Response System,consistency,39831404.00,
97.076,National Center for Missing and Exploited Children (NCMEC) ,consistency,203000.00,
97.079,Public Alert Radios for Schools,consistency,1500000.00,
97.082,Earthquake Consortium,consistency,875000.00,
97.083,Staffing for Adequate Fire and Emergency Response (SAFER),consistency,180500000.00,
97.088,Disaster Assistance Projects,consistency,4820000.00,
97.092,Repetitive Flood Claims,consistency,10000000.00,
97.093,Fire Service Hazardous Materials Preparedness and Response,consistency,50000.00,
97.094,Prevention Advocacy Resources and Data Exchange Program,consistency,30000.00,
97.095,Safe Kids Worldwide,consistency,200000.00,
97.097,Training Resource and Data Exchange,consistency,93000.00,
97.098,Disaster Donations Management Program ,consistency,375000.00,
97.099,Residential Fire Safety & Fire Sprinkler Initiatives ,consistency,170000.00,
97.103,Degrees at a Distance Program ,consistency,70000.00,
97.104,"Homeland Security-related Science, Technology, Engineering and Mathematics (HS STEM) Career Development Program",consistency,3000000.00,
97.105,Firefighter Health and Safety,consistency,150000.00,
97.107,National Incident Management System (NIMS),consistency,12648000.00,
97.109,Disaster Housing Assistance Grant,consistency,365000000.00,
97.110,Severe Repetitive Loss Program,consistency,35000000.00,
97.112,Border Infrastructure Improvement Projects,consistency,134740248.00,
97.014,Bridge Alteration,consistency,16400000.00,
97.018,National Fire Academy Training Assistance,consistency,1600000.00,
97.033,Disaster Legal Services,consistency,48553.00,
97.034,Disaster Unemployment Assistance,consistency,16036057.00,
97.049,Presidential Declared Disaster Assistance - Disaster Housing Operations for Individuals and Households,consistency,187974249.00,
97.090,Law Enforcement Officer Reimbursement Agreement Program,consistency,65027814.00,29751808.00
97.100,Airport Checked Baggage Screening Program,consistency,500000000.00,
97.022,Flood Insurance,consistency,129215961.00,
14.218,Community Development Block Grants/Entitlement Grants,timeliness,2510461000.00
14.228,Community Development Block Grants/State's program and Non-Entitlement Grants in Hawaii,consistency,1075911000.00,2028942470.00
14.231,Emergency Shelter Grants Program,consistency,160000000.00,1138534219.00
14.239,Home Investment Partnerships Program,timeliness,1654000000.00
14.241,Housing Opportunities for Persons with AIDS,timeliness,300100000.00
14.867,Indian Housing Block Grants,timeliness,550043796.00
14.872,Public Housing Capital Fund,timeliness,2080803138.00
14.881,Moving to Work Demonstration Program,consistency,3430861568.00,
14.904,Lead Outreach Grants,consistency,2000000.00,
14.169,Housing Counseling Assistance Program,timeliness,47500000.00
14.191,Multifamily Housing Service Coordinators,consistency,0.00,51651183.00
14.225,Community Development Block Grants/Special Purpose Grants/Insular Areas,timeliness,7000000.00
14.227,Community Development Block Grants/Technical Assistance Program,consistency,4000000.00,832993.00
14.235,Supportive Housing Program,consistency,827244000.00,-808485.00
14.238,Shelter Plus Care,timeliness,517135000.00
14.246,Community Development Block Grants/Brownfields Economic Development Initiative,consistency,179840000.00,32353249.00
14.247,Self-Help Homeownership Opportunity Program,consistency,26500000.00,46637351.00
14.249,Section 8 Moderate Rehabilitation Single Room Occupancy,consistency,20802000.00,50566037.00
14.250,Rural Housing and Economic Development,consistency,17000000.00,27990541.00
14.251,"Economic Development Initiative-Special Project, Neighborhood Initiative and Miscellaneous Grants",consistency,25970000.00,110942941.00
14.252,Section 4 Capacity Building for Community Development and Affordable Housing,consistency,33500000.00,
14.314,Assisted Living Conversion for Eligible Multifamily Housing Projects,consistency,0.00,237841.00
14.316,Housing Counseling Training Program,consistency,2500000.00,
14.401,Fair Housing Assistance Program_State and Local,consistency,50943000.00,24086463.00
14.408,Fair Housing Initiatives Program,consistency,2710000.00,
14.416,Education and Outreach Initiatives,consistency,2800000.00,
14.418,Private Enforcement Initiatives ,consistency,20000000.00,
14.506,General Research and Technology Activity,consistency,28447000.00,8233178.00
14.514,Hispanic-Serving Institutions Assisting Communities,consistency,5955000.00,
14.515,Alaska Native/Native Hawaiian Institutions Assisting Communities,consistency,3000000.00,
14.516,Doctoral Dissertation Research Grants,consistency,300000.00,
14.517,Early Doctoral Student Research Grants,consistency,100000.00,
14.519,Tribal Colleges and Universities Program,completeness,5000000.00
14.520,Historically Black Colleges and Universities Program,completeness,9481000.00
14.903,Operation Lead Elimination Action Program,completeness,17500000.00
14.862,Indian Community Development Block Grant Program,timeliness,55730464.00
14.866,Demolition and Revitalization of Severely Distressed Public Housing,completeness,189033902.00
14.870,Resident Opportunity and Supportive Services - Service Coordinators,consistency,33261562.00,61611752.00
14.873,Native Hawaiian Housing Block Grants,timeliness,17077770.00
14.875,Public Housing Neighborhood Networks Grants,consistency,0.00,654916.00
14.876,Resident Opportunity and Supportive Services - Elderly and Persons with Disabilities,consistency,17077543.00,
14.877,Public Housing Family Self-Sufficiency under Resident Opportunity and Supportive Services,consistency,11397522.00,
14.878,Affordable Housing Development in Main Street Rejuvenation Projects,consistency,4000000.00,
14.900,Lead-Based Paint Hazard Control in Privately-Owned Housing,consistency,70400000.00,2869834.00
14.901,Healthy Homes Demonstration Grants,consistency,4375000.00,7527387.00
14.905,Lead Hazard Reduction Demonstration Grant Program,consistency,48000000.00,124360321.00
14.149,Rent Supplements_Rental Housing for Lower Income Families,consistency,0.00,-90170343.00
14.157,Supportive Housing for the Elderly,completeness,778344000.00
14.181,Supportive Housing for Persons with Disabilities,completeness,255779000.00
14.195,Section 8 Housing Assistance Payments Program,timeliness,8726262525.00
14.197,Multifamily Assisted Housing Reform and Affordability Act,consistency,50855844.00,354408822.00
14.850,Public and Indian Housing,timeliness,3525119720.00
14.856,Lower Income Housing Assistance Program_Section 8 Moderate Rehabilitation,timeliness,182269074.00
14.871,Section 8 Housing Choice Vouchers,timeliness,11492649706.00
14.879,Mainstream Vouchers,timeliness,95479095.00
14.117,Mortgage Insurance_Homes,consistency,72172152000.00,
14.129,"Mortgage Insurance_Nursing Homes, Intermediate Care Facilities, Board and Care Homes and Assisted Living Facilities",consistency,1237500000.00,
14.133,Mortgage Insurance_Purchase of Units in Condominiums,consistency,20361187000.00,
14.135,"Mortgage Insurance_Rental and Cooperative Housing for Moderate Income Families and Elderly, Market Interest Rate",consistency,1218750000.00,
14.155,Mortgage Insurance for the Purchase or Refinancing of Existing Multifamily Housing Projects,consistency,1125000000.00,
14.183,Home Equity Conversion Mortgages,consistency,4225354720.00,
16.579,Edward Byrne Memorial Formula Grant Program,consistency,4245.00,
16.586,Violent Offender Incarceration and Truth in Sentencing Incentive Grants,consistency,1307723.00,
16.741,Forensic DNA Backlog Reduction Program,consistency,144189903.00,61507450.00
16.748,Convicted Offender and/or Arrestee DNA Backlog Reduction Program,consistency,144189903.00,6022421.00
16.015,Missing Alzheimer's Disease Patient Assistance Program,consistency,94000.00,
16.108,Americans With Disabilities Act Technical Assistance Program,consistency,17550000.00,
16.203,Comprehensive Approaches to Sex Offender Management Discretionary Grant (CASOM),consistency,3136325.00,1125346.00
16.307,Combined DNA Index System,consistency,15238207.00,
16.321,Antiterrorism Emergency Reserve,timeliness,4797982.00
16.526,OVW Technical Assistance Initiative,consistency,13759046.00,400000.00
16.527,"Supervised Visitation, Safe Havens for Children",timeliness,10413671.00
16.543,Missing Children's Assistance,timeliness,46774841.00
16.544,Youth Gang Prevention,consistency,17350215.00,2345349.00
16.547,Victims of Child Abuse,completeness,30534353.00
16.550,State Justice Statistics Program for Statistical Analysis Centers,consistency,34780000.00,2322309.00
16.560,"National Institute of Justice Research, Evaluation, and Development Project Grants",consistency,28644489.00,89394766.00
16.562,Criminal Justice Research and Development_Graduate Research Fellowships,consistency,59785.00,
16.566,National Institute of Justice W.E.B. DuBois Fellowship Program,consistency,74934.00,
16.582,Crime Victim Assistance/Discretionary Grants,timeliness,9381027.00
16.601,Corrections_Training and Staff Development,consistency,6500000.00,
16.611,Closed-Circuit Televising of Child Victims of Abuse,consistency,809660.00,
16.710,Public Safety Partnership and Community Policing Grants,consistency,339404855.00,
