Program Number,Program Name,Fiscal Year,Agency,CFDA Obligations,USASpending Obligations,Delta,Percent under/over reported
11.431,Climate and Atmospheric Research,2008,Department of Commerce,35086473.00,35086473.00,0.00,0.00
11.433,Marine Fisheries Initiative,2008,Department of Commerce,2064592.00,2064592.00,0.00,0.00
11.434,Cooperative Fishery Statistics,2008,Department of Commerce,923500.00,923500.00,0.00,0.00
11.435,Southeast Area Monitoring and Assessment Program,2008,Department of Commerce,3716304.00,,-3716304.00,-1.00
11.436,Columbia River Fisheries Development Program,2008,Department of Commerce,12741548.00,12741548.00,0.00,0.00
11.437,Pacific Fisheries Data Program,2008,Department of Commerce,18412514.00,18412514.00,0.00,0.00
11.438,Pacific Coast Salmon Recovery_Pacific Salmon Treaty Program,2008,Department of Commerce,68385751.00,68385751.00,0.00,0.00
11.439,Marine Mammal Data Program,2008,Department of Commerce,9605008.00,9605008.00,0.00,0.00
11.440,"Environmental Sciences, Applications, Data, and Education",2008,Department of Commerce,4453731.00,4453731.00,0.00,0.00
11.441,Regional Fishery Management Councils,2008,Department of Commerce,22928589.00,22928589.00,0.00,0.00
11.443,Short Term Climate Fluctuations,2008,Department of Commerce,0.00,,0.00,0.00
11.444,Hawaii Sustainable Fisheries Development (Aquaculture Program),2008,Department of Commerce,0.00,,0.00,0.00
11.445,Hawaii Stock Management Program,2008,Department of Commerce,0.00,,0.00,0.00
11.450,Automated Flood Warning Systems (AFWS),2008,Department of Commerce,0.00,,0.00,0.00
11.452,Unallied Industry Projects,2008,Department of Commerce,9239991.00,9239991.00,0.00,0.00
11.454,Unallied Management Projects,2008,Department of Commerce,115706448.00,115706448.00,0.00,0.00
11.455,Cooperative Science and Education Program,2008,Department of Commerce,1950692.00,1950692.00,0.00,0.00
11.457,Chesapeake Bay Studies,2008,Department of Commerce,7717411.00,7717411.00,0.00,0.00
11.459,Weather and Air Quality Research,2008,Department of Commerce,436269.00,436269.00,0.00,0.00
11.460,Special Oceanic and Atmospheric Projects,2008,Department of Commerce,11485564.00,11485564.00,0.00,0.00
11.462,Hydrologic Research,2008,Department of Commerce,634735.00,634735.00,0.00,0.00
11.463,Habitat Conservation,2008,Department of Commerce,50553994.00,42699027.00,-7854967.00,-0.16
11.467,Meteorologic and Hydrologic Modernization Development,2008,Department of Commerce,7348084.00,7348084.00,0.00,0.00
11.468,Applied Meteorological Research,2008,Department of Commerce,12891234.00,12891234.00,0.00,0.00
11.469,Congressionally Identified Awards and  Projects,2008,Department of Commerce,19592419.00,19592419.00,0.00,0.00
11.472,Unallied Science Program,2008,Department of Commerce,15540052.00,15540052.00,0.00,0.00
11.474,Atlantic Coastal Fisheries Cooperative Management Act,2008,Department of Commerce,7037464.00,7037464.00,0.00,0.00
11.478,Center for Sponsored Coastal Ocean Research_Coastal Ocean Program,2008,Department of Commerce,9513702.00,9513702.00,0.00,0.00
11.481,Educational Partnership Program,2008,Department of Commerce,12219165.00,12219165.00,0.00,0.00
11.550,Public Telecommunications Facilities Planning and Construction,2008,Department of Commerce,19456872.00,18046155.00,-1410717.00,-0.07
11.553,Special Projects,2008,Department of Commerce,21645000.00,21645000.00,0.00,0.00
11.554,Low-Power Television and Translator Digital-to-Analog Conversion,2008,Department of Commerce,10000000.00,102000.00,-9898000.00,-0.99
11.555,Public Safety Interoperable Communications Grant Program,2008,Department of Commerce,0.00,12397799.00,12397799.00,
11.557,Broadband Technology Opportunities Program (BTOP),2008,Department of Commerce,0.00,,0.00,0.00
11.558,State Broadband Data and Development Grant Program,2008,Department of Commerce,0.00,,0.00,0.00
11.559,Low-Power Television and Translator Upgrade Program,2008,Department of Commerce,0.00,,0.00,0.00
11.609,Measurement and Engineering Research and Standards,2008,Department of Commerce,39043000.00,45601251.00,6558251.00,0.17
11.616,Technology Innovation Program (TIP) ,2008,Department of Commerce,0.00,,0.00,0.00
11.618,National Institute of Standards and Technology Construction Grant Program ,2008,Department of Commerce,0.00,,0.00,0.00
12.351,Basic  Scientific Research - Combating Weapons of Mass Destruction ,2008,Department of Defense,38000000.00,31321833.00,-6678167.00,-0.18
12.352,Scientific Research - Combating Weapons of Mass Destruction,2008,Department of Defense,1000000.00,,-1000000.00,-1.00
12.360,Research on Chemical and Biological Defense,2008,Department of Defense,10000000.00,6544693.00,-3455307.00,-0.35
12.400,"Military Construction, National Guard",2008,Department of Defense,101700000.00,377025400.00,275325400.00,2.71
12.550,National Flagship Language Program Grants To U.S. Institutions Of Higher Education,2008,Department of Defense,12000000.00,,-12000000.00,-1.00
12.553,National Flagship Language Program Fellowships,2008,Department of Defense,12000000.00,,-12000000.00,-1.00
12.556,Competitive Grants: Promoting K-12 Student Achievement at Military-Connected Schools,2008,Department of Defense,0.00,,0.00,0.00
12.557,Invitational Grants for Military-Connected Schools,2008,Department of Defense,900000.00,,-900000.00,-1.00
12.607,"Community Economic Adjustment Assistance for Establishment, Expansion, Realignment, or Closure of a Military Installation",2008,Department of Defense,45000000.00,30735568.00,-14264432.00,-0.32
12.611,Community Economic Adjustment Planning Assistance for Reductions in Defense Industry Employment,2008,Department of Defense,2000000.00,96853.00,-1903147.00,-0.95
12.614,Community Economic Adjustment Diversification Planning,2008,Department of Defense,1500000.00,764000.00,-736000.00,-0.49
12.615,RESEARCH AND TECHNICAL ASSISTANCE,2008,Department of Defense,1092332.00,,-1092332.00,-1.00
14.169,Housing Counseling Assistance Program,2008,Department of Housing and Urban Development,47000000.00,42604833.00,-4395167.00,-0.09
14.225,Community Development Block Grants/Special Purpose Grants/Insular Areas,2008,Department of Housing and Urban Development,7000000.00,7893516.00,893516.00,0.13
14.227,Community Development Block Grants/Technical Assistance Program,2008,Department of Housing and Urban Development,3000000.00,832993.00,-2167007.00,-0.72
14.235,Supportive Housing Program,2008,Department of Housing and Urban Development,1059172000.00,-808485.00,-1059980485.00,-1.00
14.238,Shelter Plus Care,2008,Department of Housing and Urban Development,350741000.00,365128830.00,14387830.00,0.04
14.246,Community Development Block Grants/Brownfields Economic Development Initiative,2008,Department of Housing and Urban Development,10000000.00,32353249.00,22353249.00,2.24
14.247,Self-Help Homeownership Opportunity Program,2008,Department of Housing and Urban Development,26500000.00,46637351.00,20137351.00,0.76
14.249,Section 8 Moderate Rehabilitation Single Room Occupancy,2008,Department of Housing and Urban Development,16077000.00,50566037.00,34489037.00,2.15
14.250,Rural Housing and Economic Development,2008,Department of Housing and Urban Development,17000000.00,27990541.00,10990541.00,0.65
14.251,"Economic Development Initiative-Special Project, Neighborhood Initiative and Miscellaneous Grants",2008,Department of Housing and Urban Development,25970000.00,110942941.00,84972941.00,3.27
14.252,Section 4 Capacity Building for Affordable Housing and Community Development Grants,2008,Department of Housing and Urban Development,33500000.00,,-33500000.00,-1.00
14.316,Housing Counseling Training Program,2008,Department of Housing and Urban Development,3000000.00,,-3000000.00,-1.00
14.318,Assisted Housing Stability and Energy and Green Retrofit Investments Program (Recovery Act Funded),2008,Department of Housing and Urban Development,0.00,,0.00,0.00
14.401,Fair Housing Assistance Program_State and Local,2008,Department of Housing and Urban Development,25620000.00,24086463.00,-1533537.00,-0.06
14.408,Fair Housing Initiatives Program,2008,Department of Housing and Urban Development,24000000.00,,-24000000.00,-1.00
14.506,General Research and Technology Activity,2008,Department of Housing and Urban Development,30478902.00,8233178.00,-22245724.00,-0.73
14.514,Hispanic-Serving Institutions Assisting Communities,2008,Department of Housing and Urban Development,6000000.00,,-6000000.00,-1.00
14.515,Alaska Native/Native Hawaiian Institutions Assisting Communities,2008,Department of Housing and Urban Development,3000000.00,,-3000000.00,-1.00
14.516,Doctoral Dissertation Research Grants,2008,Department of Housing and Urban Development,300000.00,,-300000.00,-1.00
14.517,Early Doctoral Student Research Grants,2008,Department of Housing and Urban Development,100000.00,,-100000.00,-1.00
14.519,Tribal Colleges and Universities Program,2008,Department of Housing and Urban Development,5000000.00,5000000.00,0.00,0.00
14.520,Historically Black Colleges and Universities Program,2008,Department of Housing and Urban Development,9000000.00,9280988.00,280988.00,0.03
14.862,Indian Community Development Block Grant Program,2008,Department of Housing and Urban Development,62000000.00,51630461.00,-10369539.00,-0.17
14.866,Demolition and Revitalization of Severely Distressed Public Housing,2008,Department of Housing and Urban Development,97600000.00,193059934.00,95459934.00,0.98
14.870,Resident Opportunity and Supportive Services - Service Coordinators,2008,Department of Housing and Urban Development,40000000.00,61611752.00,21611752.00,0.54
14.873,Native Hawaiian Housing Block Grants,2008,Department of Housing and Urban Development,8700000.00,17077770.00,8377770.00,0.96
14.875,Public Housing Neighborhood Networks Grants,2008,Department of Housing and Urban Development,0.00,654916.00,654916.00,
14.878,Affordable Housing Development in Main Street Rejuvenation Projects,2008,Department of Housing and Urban Development,4000000.00,,-4000000.00,-1.00
14.883,Native Hawaiian Housing Block Grants (Recovery Act Funded),2008,Department of Housing and Urban Development,0.00,,0.00,0.00
14.882,Native American Housing Block Grants (Formula) Recovery Act Funded,2008,Department of Housing and Urban Development,0.00,,0.00,0.00
14.886,Indian Community Development Block Grant Program  (Recovery Act Funded),2008,Department of Housing and Urban Development,0.00,,0.00,0.00
14.900,Lead-Based Paint Hazard Control in Privately-Owned Housing,2008,Department of Housing and Urban Development,86600000.00,2869834.00,-83730166.00,-0.97
14.905,Lead Hazard Reduction Demonstration Grant Program,2008,Department of Housing and Urban Development,44000000.00,124360321.00,80360321.00,1.83
15.027,Assistance to Tribally Controlled Community Colleges and Universities,2008,Department of the Interior,56713000.00,28060780.00,-28652220.00,-0.51
15.028,Tribally Controlled Community College Endowments,2008,Department of the Interior,107000.00,,-107000.00,-1.00
15.043,Indian Child and Family Education,2008,Department of the Interior,5683000.00,7081944.00,1398944.00,0.25
15.046,Administrative Cost Grants for Indian Schools,2008,Department of the Interior,43373000.00,35383029.00,-7989971.00,-0.18
15.059,Indian Graduate Student Scholarships,2008,Department of the Interior,2164000.00,2065175.00,-98825.00,-0.05
15.114,Indian Education_Higher Education Grant Program,2008,Department of the Interior,25959000.00,,-25959000.00,-1.00
15.141,Indian Housing Assistance,2008,Department of the Interior,13000000.00,9428772.00,-3571228.00,-0.27
15.144,Indian Child Welfare Act_Title II Grants,2008,Department of the Interior,10974000.00,2995884.00,-7978116.00,-0.73
15.224,Cultural Resource Management,2008,Department of the Interior,3350000.00,14713212.00,11363212.00,3.39
15.225,Recreation Resource Management,2008,Department of the Interior,4340000.00,19040232.00,14700232.00,3.39
15.228,National Fire Plan - Wildland Urban Interface Community Fire Assistance,2008,Department of the Interior,7360000.00,20595815.00,13235815.00,1.80
15.229,Wild Horse and Burro Resource Management,2008,Department of the Interior,2950000.00,154000.00,-2796000.00,-0.95
15.230,Invasive and Noxious Plant Management,2008,Department of the Interior,2800000.00,,-2800000.00,-1.00
15.231,"Fish, Wildlife and Plant Conservation Resource Management",2008,Department of the Interior,22740000.00,33763949.00,11023949.00,0.48
15.232,Wildland Fire Research and Studies Program,2008,Department of the Interior,230000.00,30000.00,-200000.00,-0.87
15.233,Forests and Woodlands Resource Management,2008,Department of the Interior,500000.00,139600.00,-360400.00,-0.72
15.234,Secure Rural Schools and Community Self-Determination,2008,Department of the Interior,8800000.00,,-8800000.00,-1.00
15.235,Southern Nevada Public Land Management,2008,Department of the Interior,96000000.00,,-96000000.00,-1.00
15.236,Environmental Quality and Protection Resource Management,2008,Department of the Interior,7500000.00,,-7500000.00,-1.00
15.237,Rangeland Resource Management,2008,Department of the Interior,325000.00,71500.00,-253500.00,-0.78
15.238,Challenge Cost Share,2008,Department of the Interior,3800000.00,180550.00,-3619450.00,-0.95
15.239,Management Initiatives,2008,Department of the Interior,2000000.00,,-2000000.00,-1.00
15.240,Helium Resource Management,2008,Department of the Interior,6900000.00,,-6900000.00,-1.00
15.242,National Fire Plan - Rural Fire Assistance,2008,Department of the Interior,6032000.00,2888076.00,-3143924.00,-0.52
15.250,Regulation of Surface Coal Mining and Surface Effects of Underground Coal Mining,2008,Department of the Interior,60559.00,,-60559.00,-1.00
15.253,Not-for-Profit AMD Reclamation,2008,Department of the Interior,1500000.00,1326048.00,-173952.00,-0.12
15.255,Applied Science Program Cooperative Agreements Related to Coal Mining and Reclamation,2008,Department of the Interior,1400000.00,1659897.00,259897.00,0.19
15.421,Alaska Coastal Marine Institute,2008,Department of the Interior,750000.00,1075724.00,325724.00,0.43
15.422,Louisiana State University (LSU) Coastal Marine Institute  (CMI),2008,Department of the Interior,1000000.00,3278665.00,2278665.00,2.28
15.423,Minerals Management Service (MMS) Environmental Studies Program (ESP),2008,Department of the Interior,1000000.00,2698640.00,1698640.00,1.70
15.424,Marine Minerals Activities,2008,Department of the Interior,1280000.00,140661.00,-1139339.00,-0.89
15.425,Offshore Research Technology Center (OTRC) Texas Engineering Experiment Station (TEES),2008,Department of the Interior,400000.00,,-400000.00,-1.00
15.427,Federal Oil and Gas Royalty Management,2008,Department of the Interior,10180000.00,16743884.00,6563884.00,0.64
15.428,Marine Gas Hydrate Research Activities,2008,Department of the Interior,850000.00,,-850000.00,-1.00
15.506,Water Desalination Research and Development Program,2008,Department of the Interior,2275000.00,7119353.00,4844353.00,2.13
15.507,Water 2025,2008,Department of the Interior,11000000.00,17278265.00,6278265.00,0.57
15.638,Tribal Landowner Incentive Program,2008,Department of the Interior,0.00,,0.00,0.00
15.508,Providing Water to At-Risk Natural Desert Terminal Lakes,2008,Department of the Interior,75000000.00,19046838.00,-55953162.00,-0.75
15.509,Colorado River Basin Salinity Control Program,2008,Department of the Interior,7850000.00,19049171.00,11199171.00,1.43
15.510,Colorado Ute Indian Water Rights Settlement Act,2008,Department of the Interior,35000000.00,,-35000000.00,-1.00
15.513,Dutch John Federal Property and Disposition  Assistance Act,2008,Department of the Interior,376000.00,916477.00,540477.00,1.44
15.514,Reclamation States Emergency Drought Relief,2008,Department of the Interior,436000.00,1334106.00,898106.00,2.06
15.516,Fort Peck Reservation Rural Water System ,2008,Department of the Interior,6763000.00,9515000.00,2752000.00,0.41
15.518,Garrison Diversion Unit,2008,Department of the Interior,17642000.00,56034031.00,38392031.00,2.18
15.520,Lewis and Clark Rural Water System ,2008,Department of the Interior,26000000.00,,-26000000.00,-1.00
15.521,Lower Rio Grande Valley Water Resources Conservation and Improvement,2008,Department of the Interior,2519000.00,3721429.00,1202429.00,0.48
15.522,Mni Wiconi Rural Water Supply Project,2008,Department of the Interior,26309000.00,47475000.00,21166000.00,0.80
15.523,Perkins County Rural Water System,2008,Department of the Interior,3060000.00,6120000.00,3060000.00,1.00
15.525,Rocky Boy's/North Central Montana Regional Water System ,2008,Department of the Interior,5704015.00,11408030.00,5704015.00,1.00
15.526,San Gabriel Basin Restoration Project,2008,Department of the Interior,400000.00,1249468.00,849468.00,2.12
15.528,St. Mary Storage Unit Facilities Rehabilitation Project,2008,Department of the Interior,0.00,,0.00,0.00
15.529,Upper Colorado and San Juan River Basins Endangered Fish Recovery Programs,2008,Department of the Interior,1600000.00,3139635.00,1539635.00,0.96
15.530,Water Conservation Field Services Program (WCFSP),2008,Department of the Interior,14340000.00,,-14340000.00,-1.00
15.531,Yakima River Basin Water Enhancement Project (YRBWEP),2008,Department of the Interior,6500000.00,4765250.00,-1734750.00,-0.27
15.532,"Central Valley Project, Trinity River Division, Trinity River  Fish and Wildlife Management",2008,Department of the Interior,1000000.00,3635958.00,2635958.00,2.64
15.535,Upper Colorado River Basin Fish and Wildlife Mitigation Program.,2008,Department of the Interior,24000.00,,-24000.00,-1.00
15.614,"Coastal Wetlands Planning, Protection and Restoration Act",2008,Department of the Interior,20575000.00,17079568.00,-3495432.00,-0.17
15.615,Cooperative Endangered Species Conservation Fund,2008,Department of the Interior,73831000.00,68611711.00,-5219289.00,-0.07
15.616,Clean Vessel Act,2008,Department of the Interior,13250000.00,9659714.00,-3590286.00,-0.27
15.619,Rhinoceros and Tiger Conservation Fund,2008,Department of the Interior,1870000.00,891158.00,-978842.00,-0.52
15.620,African Elephant Conservation Fund,2008,Department of the Interior,1378000.00,,-1378000.00,-1.00
15.621,Asian Elephant Conservation Fund,2008,Department of the Interior,1378000.00,900620.00,-477380.00,-0.35
15.622,Sportfishing and Boating Safety Act,2008,Department of the Interior,13400000.00,12560015.00,-839985.00,-0.06
15.623,North American Wetlands Conservation Fund,2008,Department of the Interior,80144640.00,39284086.00,-40860554.00,-0.51
15.628,Multistate Conservation Grant Program,2008,Department of the Interior,6000000.00,4801614.00,-1198386.00,-0.20
15.629,Great Apes Conservation Fund,2008,Department of the Interior,1870000.00,4567109.00,2697109.00,1.44
15.635,Neotropical Migratory Bird Conservation ,2008,Department of the Interior,4296906.00,1641041.00,-2655865.00,-0.62
15.636,Alaska Subsistence Management,2008,Department of the Interior,5200000.00,3760464.00,-1439536.00,-0.28
15.637,Migratory Bird Joint Ventures,2008,Department of the Interior,5000000.00,2589475.00,-2410525.00,-0.48
15.639,Tribal Wildlife Grants Program,2008,Department of the Interior,6000000.00,,-6000000.00,-1.00
15.640,Wildlife Without Borders- Latin America and the Caribbean ,2008,Department of the Interior,1229000.00,,-1229000.00,-1.00
15.641,Wildlife Without Borders-Mexico ,2008,Department of the Interior,697000.00,101000.00,-596000.00,-0.86
15.643,Alaska Migratory Bird Co-Management Council,2008,Department of the Interior,222600.00,211000.00,-11600.00,-0.05
15.645,Marine Turtle Conservation Fund,2008,Department of the Interior,906000.00,647701.00,-258299.00,-0.29
15.647,Migratory  Bird Conservation,2008,Department of the Interior,365800.00,483679.00,117879.00,0.32
15.649,Service Training and Technical Assistance (Generic Training),2008,Department of the Interior,91000.00,497195.00,406195.00,4.46
15.650,Research Grants (Generic),2008,Department of the Interior,50000.00,,-50000.00,-1.00
15.651,Wildlife Without Borders-Africa Program,2008,Department of the Interior,500000.00,535194.00,35194.00,0.07
15.653,National Outreach and Communication Program,2008,Department of the Interior,13400000.00,12000.00,-13388000.00,-1.00
15.655,"Migratory Bird Monitoring, Assessment and Conservation",2008,Department of the Interior,2205000.00,697267.00,-1507733.00,-0.68
15.656,"Recovery Act Funds - Habitat Enhancement, Restoration and Improvement.",2008,Department of the Interior,0.00,,0.00,0.00
15.807,Earthquake Hazards Reduction Program,2008,Department of the Interior,13138000.00,20040777.00,6902777.00,0.53
15.808,U.S. Geological Survey_ Research and Data Collection,2008,Department of the Interior,41000000.00,56425440.00,15425440.00,0.38
15.810,National Cooperative Geologic Mapping Program,2008,Department of the Interior,6981655.00,,-6981655.00,-1.00
15.811,Gap Analysis Program  ,2008,Department of the Interior,2100000.00,4032128.00,1932128.00,0.92
15.812,Cooperative Research Units Program ,2008,Department of the Interior,16000000.00,21538119.00,5538119.00,0.35
15.813,Cooperative Research Units Training Program,2008,Department of the Interior,150000.00,1350000.00,1200000.00,8.00
15.814,National Geological and Geophysical Data Preservation Program,2008,Department of the Interior,500000.00,,-500000.00,-1.00
15.815,National Land Remote Sensing_Education Outreach and Research,2008,Department of the Interior,960000.00,,-960000.00,-1.00
15.816,Minerals Resources External Research Program,2008,Department of the Interior,115478.00,,-115478.00,-1.00
15.875,"Economic, Social, and Political Development of the Territories",2008,Department of the Interior,223475000.00,214278220.00,-9196780.00,-0.04
15.916,"Outdoor Recreation_Acquisition, Development and Planning",2008,Department of the Interior,23133400.00,35240967.00,12107567.00,0.52
15.922,Native American Graves Protection and Repatriation Act,2008,Department of the Interior,2400000.00,,-2400000.00,-1.00
15.923,National Center for Preservation Technology and Training,2008,Department of the Interior,165415.00,,-165415.00,-1.00
15.926,American Battlefield Protection,2008,Department of the Interior,1367144.00,172320.00,-1194824.00,-0.87
15.928,Civil War Battlefield Land Acquisition Grants,2008,Department of the Interior,3000000.00,,-3000000.00,-1.00
15.929,Save America's Treasures,2008,Department of the Interior,24610000.00,1402600.00,-23207400.00,-0.94
15.930,Chesapeake Bay Gateways Network,2008,Department of the Interior,550000.00,,-550000.00,-1.00
15.931,Conservation Activities by Youth Service Organizations,2008,Department of the Interior,10400000.00,3750264.00,-6649736.00,-0.64
15.932,Preservation of Historic Structures on the Campuses of Historically Black Colleges and Universities (HBCUs).,2008,Department of the Interior,0.00,,0.00,0.00
15.978,Upper Mississippi River System Long Term Resource Monitoring Program,2008,Department of the Interior,2691425.00,4573213.00,1881788.00,0.70
16.015,Missing Alzheimer's Disease Patient Assistance Program,2008,Department of Justice,94000.00,,-94000.00,-1.00
16.108,Americans With Disabilities Act Technical Assistance Program,2008,Department of Justice,17550000.00,,-17550000.00,-1.00
16.110,Education and Enforcement of the Antidiscrimination Provision of the Immigration and Nationality Act,2008,Department of Justice,710500.00,710500.00,0.00,0.00
16.202,Prisoner Reentry Initiative Demonstration (Offender Reentry),2008,Department of Justice,11750000.00,10837760.00,-912240.00,-0.08
16.203,Comprehensive Approaches to Sex Offender Management Discretionary Grant (CASOM),2008,Department of Justice,4162000.00,1125346.00,-3036654.00,-0.73
16.307,Combined DNA Index System,2008,Department of Justice,15238207.00,,-15238207.00,-1.00
16.320,Services for Trafficking Victims,2008,Department of Justice,9400000.00,7927711.00,-1472289.00,-0.16
16.321,Antiterrorism Emergency Reserve,2008,Department of Justice,50000000.00,4774137.00,-45225863.00,-0.90
16.524,Legal Assistance for Victims,2008,Department of Justice,27897281.00,27801960.00,-95321.00,0.00
16.525,"Grants to Reduce Domestic Violence, Dating Violence, Sexual Assault, and Stalking on Campus",2008,Department of Justice,6537812.00,6422850.00,-114962.00,-0.02
16.526,OVW Technical Assistance Initiative,2008,Department of Justice,12734568.00,400000.00,-12334568.00,-0.97
16.527,"Supervised Visitation, Safe Havens for Children",2008,Department of Justice,11268417.00,9613671.00,-1654746.00,-0.15
16.528,Enhanced Training and Services to End Violence and Abuse of Women Later in Life,2008,Department of Justice,3726679.00,3247172.00,-479507.00,-0.13
16.529,"Education, Training, and Enhanced Services to End Violence Against and Abuse of Women with Disabilities ",2008,Department of Justice,7055000.00,6474079.00,-580921.00,-0.08
16.541,"Part E - Developing, Testing and Demonstrating Promising New Programs",2008,Department of Justice,830000.00,105477801.00,104647801.00,126.08
16.543,Missing Children's Assistance,2008,Department of Justice,50000000.00,41162964.00,-8837036.00,-0.18
16.547,Victims of Child Abuse,2008,Department of Justice,3290000.00,15764420.00,12474420.00,3.79
16.550,State Justice Statistics Program for Statistical Analysis Centers,2008,Department of Justice,34780000.00,2322309.00,-32457691.00,-0.93
16.554,National Criminal History Improvement Program (NCHIP),2008,Department of Justice,9400000.00,11422449.00,2022449.00,0.22
16.557,Tribal Domestic Violence and Sexual Assault Coalitions Program,2008,Department of Justice,5108911.00,3946267.00,-1162644.00,-0.23
16.560,"National Institute of Justice Research, Evaluation, and Development Project Grants",2008,Department of Justice,17260000.00,89394766.00,72134766.00,4.18
