Program Number,Program Name,Fiscal Year,Agency,CFDA Obligations,USASpending Obligations,Delta,Percent under/over reported
66.708,Pollution Prevention Grants Program,2010,Environmental Protection Agency,4940000.00,3878237.00,-1061763.00,-0.21
66.709,Multi-Media Capacity Building Grants for States and Tribes,2010,Environmental Protection Agency,1685000.00,1156329.00,-528671.00,-0.31
66.714,Pesticide Environmental Stewardship Regional Grants ,2010,Environmental Protection Agency,500000.00,221465.00,-278535.00,-0.56
66.715,Lead Educational Outreach and Baseline Assessment of Tribal Children's Exposure and Risks Associated With Lead,2010,Environmental Protection Agency,500000.00,656833.00,156833.00,0.31
66.716,"Research, Development, Monitoring, Public Education, Training, Demonstrations, and Studies",2010,Environmental Protection Agency,6775000.00,6605574.00,-169426.00,-0.03
66.717,Source Reduction Assistance,2010,Environmental Protection Agency,1375000.00,1646516.00,271516.00,0.20
66.718,National Community-Based Lead Outreach and Training Grant Program ,2010,Environmental Protection Agency,0.00,781019.00,781019.00,
66.802,"Superfund State, Political Subdivision, and Indian Tribe Site_Specific Cooperative Agreements",2010,Environmental Protection Agency,80000000.00,95733797.00,15733797.00,0.20
66.806,Superfund Technical Assistance Grants (TAG) for Community Groups at National Priority List (NPL) Sites,2010,Environmental Protection Agency,500000.00,875600.00,375600.00,0.75
66.808,Solid Waste Management Assistance Grants,2010,Environmental Protection Agency,1800000.00,4344068.00,2544068.00,1.41
66.809,Superfund State and Indian Tribe Core Program Cooperative Agreements,2010,Environmental Protection Agency,8000000.00,7136796.00,-863204.00,-0.11
66.810,Chemical Emergency Preparedness and Prevention (CEPP) Technical Assistance Grants Program,2010,Environmental Protection Agency,160000.00,70000.00,-90000.00,-0.56
66.812,Hazardous Waste Management Grant Program for Tribes,2010,Environmental Protection Agency,319000.00,394808.00,75808.00,0.24
66.813,"Alternative or Innovative Treatment Technology Research, Demonstration, Training, and Hazardous Substance Research Grants",2010,Environmental Protection Agency,1040000.00,1529375.00,489375.00,0.47
66.814,"Brownfields Training, Research, and Technical Assistance Grants and Cooperative Agreements ",2010,Environmental Protection Agency,7540000.00,3463745.00,-4076255.00,-0.54
66.815,Brownfield Job Training Cooperative Agreements,2010,Environmental Protection Agency,2600000.00,4407941.00,1807941.00,0.70
66.816,Headquarters and Regional Underground Storage Tanks Program,2010,Environmental Protection Agency,3318918.00,1233868.00,-2085050.00,-0.63
66.818,Brownfields Assessment and Cleanup Cooperative Agreements,2010,Environmental Protection Agency,86000000.00,109648596.00,23648596.00,0.27
66.926,Indian Environmental General Assistance Program (GAP),2010,Environmental Protection Agency,62875000.00,51809157.00,-11065843.00,-0.18
66.931,International Financial Assistance Projects Sponsored by the Office of International Affairs,2010,Environmental Protection Agency,3000000.00,4332530.00,1332530.00,0.44
66.940,Environmental Policy and State Innovation Grants,2010,Environmental Protection Agency,0.00,70000.00,70000.00,
66.950,Environmental Education and Training Program,2010,Environmental Protection Agency,2259500.00,,-2259500.00,-1.00
66.951,Environmental Education Grants,2010,Environmental Protection Agency,3400000.00,3805400.00,405400.00,0.12
66.952,National Network for Environmental Management Studies Fellowship Program,2010,Environmental Protection Agency,450000.00,255558.00,-194442.00,-0.43
77.006,U. S. Nuclear Regulatory Commission Nuclear Education Grant Program,2010,Nuclear Regulatory Commission,4700000.00,0.00,-4700000.00,-1.00
77.008,U.S. Nuclear Regulatory Commission Scholarship and Fellowship Program,2010,Nuclear Regulatory Commission,15000000.00,11109605.00,-3890395.00,-0.26
77.009,U.S. Nuclear Regulatory Commission Office of Research Financial Assistance Program,2010,Nuclear Regulatory Commission,1500000.00,79780.00,-1420220.00,-0.95
81.022,Used Energy-Related Laboratory Equipment Grants,2010,Department of Energy,0.00,,0.00,0.00
81.036,Inventions and Innovations,2010,Department of Energy,102000.00,2447127.00,2345127.00,22.99
81.049,Office of Science Financial Assistance Program,2010,Department of Energy,1290000000.00,1236357115.00,-53642885.00,-0.04
81.057,University Coal Research,2010,Department of Energy,2145228.00,1119604.00,-1025624.00,-0.48
81.065,Nuclear Waste Disposal Siting,2010,Department of Energy,27000000.00,6548190.00,-20451810.00,-0.76
81.079,Regional Biomass Energy Programs,2010,Department of Energy,4781750.00,4735988.00,-45762.00,-0.01
81.086,Conservation Research and Development,2010,Department of Energy,1722290324.00,2091136639.00,368846315.00,0.21
81.087,Renewable Energy Research and Development,2010,Department of Energy,1942659482.00,2124608946.00,181949464.00,0.09
81.089,Fossil Energy Research and Development,2010,Department of Energy,400000000.00,1348907661.00,948907661.00,2.37
81.104,Office of Environmental Waste Processing,2010,Department of Energy,4500000.00,21763082.00,17263082.00,3.84
81.105,"National Industrial Competitiveness through Energy, Environment, and Economics",2010,Department of Energy,0.00,-198589.00,-198589.00,
81.106,"Transport of Transuranic Wastes to the Waste Isolation Pilot Plant: States and Tribal Concerns, Proposed Solutions",2010,Department of Energy,28908000.00,28939000.00,31000.00,0.00
81.108,Epidemiology and Other Health Studies Financial Assistance Program,2010,Department of Energy,25000000.00,22085606.00,-2914394.00,-0.12
81.112,Stewardship Science Grant Program,2010,Department of Energy,87000000.00,84279286.00,-2720714.00,-0.03
81.113,Defense Nuclear Nonproliferation Research,2010,Department of Energy,25133368.00,39534033.00,14400665.00,0.57
81.117,"Energy Efficiency and Renewable Energy Information Dissemination, Outreach, Training and Technical Analysis/Assistance",2010,Department of Energy,41240972.00,72152344.00,30911372.00,0.75
81.119,State Energy Program Special Projects,2010,Department of Energy,10576696.00,9663837.00,-912859.00,-0.09
81.121,"Nuclear Energy Research, Development and Demonstration",2010,Department of Energy,140516512.00,149648313.00,9131801.00,0.06
81.122,"Electricity Delivery and Energy Reliability, Research, Development and Analysis",2010,Department of Energy,4190000000.00,4271299497.00,81299497.00,0.02
81.123,National Nuclear Security Administration (NNSA) Minority Serving Institutions (MSI) Program,2010,Department of Energy,19855000.00,18827584.00,-1027416.00,-0.05
81.124,Predictive Science Academic Alliance Program,2010,Department of Energy,16500000.00,21200000.00,4700000.00,0.28
81.129,"Energy Efficiency and Renewable Energy Technology Deployment, Demonstration and Commercialization",2010,Department of Energy,7217263.00,7217263.00,0.00,0.00
81.133,Geologic Sequestration Training and Research Grant Program,2010,Department of Energy,0.00,0.00,0.00,0.00
81.135,Advanced Research and Projects Agency  Energy Financial Assistance Program  ,2010,Department of Energy,384000000.00,316368170.00,-67631830.00,-0.18
81.136,Long-Term Surveillance and Maintenance,2010,Department of Energy,3937887.00,5566620.00,1628733.00,0.41
84.004,Civil Rights Training and Advisory Services,2010,Department of Education,6989000.00,6968991.00,-20009.00,0.00
84.015,National Resource Centers Program for Foreign Language and Area Studies or Foreign Language and International Studies Program and Foreign Language and Area Studies Fellowship Program,2010,Department of Education,69619000.00,70506893.00,887893.00,0.01
84.016,Undergraduate International Studies and Foreign Language Programs,2010,Department of Education,4634000.00,4634000.00,0.00,0.00
84.017,International Research and Studies,2010,Department of Education,6585577.00,7151631.00,566054.00,0.09
84.018,Overseas Programs_Special Bilateral Projects,2010,Department of Education,2249221.00,,-2249221.00,-1.00
84.019,Overseas Programs - Faculty Research Abroad,2010,Department of Education,1584200.00,1402656.00,-181544.00,-0.11
84.021,Overseas Programs - Group Projects Abroad,2010,Department of Education,5504123.00,10845675.00,5341552.00,0.97
84.022,Overseas Programs - Doctoral Dissertation Research Abroad,2010,Department of Education,5984734.00,6367716.00,382982.00,0.06
84.031,Higher Education_Institutional Aid,2010,Department of Education,864197000.00,738845754.00,-125351246.00,-0.15
84.040,Impact Aid_Facilities Maintenance,2010,Department of Education,4864000.00,4800000.00,-64000.00,-0.01
84.042,TRIO_Student Support Services,2010,Department of Education,301000000.00,302213119.00,1213119.00,0.00
84.044,TRIO_Talent Search,2010,Department of Education,142000000.00,141384603.00,-615397.00,0.00
84.047,TRIO_Upward Bound,2010,Department of Education,360100000.00,453385073.00,93285073.00,0.26
84.051,Career and Technical Education -- National Programs,2010,Department of Education,7860000.00,6052047.00,-1807953.00,-0.23
84.066,TRIO_Educational Opportunity Centers,2010,Department of Education,46800000.00,46724127.00,-75873.00,0.00
84.083,Women's Educational Equity Act Program,2010,Department of Education,2423000.00,2422995.00,-5.00,0.00
84.101,Career and Technical Education - Indian Set-aside,2010,Department of Education,14511000.00,14511388.00,388.00,0.00
84.103,TRIO Staff Training Program,2010,Department of Education,3400000.00,3641500.00,241500.00,0.07
84.116,Fund for the Improvement of Postsecondary Education,2010,Department of Education,159403000.00,157935174.00,-1467826.00,-0.01
84.120,Minority Science and Engineering Improvement,2010,Department of Education,9503000.00,9503000.00,0.00,0.00
84.128,Rehabilitation Services_Service Projects,2010,Department of Education,4713000.00,4646543.00,-66457.00,-0.01
84.129,Rehabilitation Long-Term Training,2010,Department of Education,19549000.00,20742307.00,1193307.00,0.06
84.132,Centers for Independent Living,2010,Department of Education,80266000.00,79062829.00,-1203171.00,-0.01
84.133,National Institute on Disability and Rehabilitation Research,2010,Department of Education,109241000.00,105558511.00,-3682489.00,-0.03
84.141,Migrant Education_High School Equivalency Program,2010,Department of Education,19948431.00,19890431.00,-58000.00,0.00
84.144,Migrant Education_Coordination Program,2010,Department of Education,3000000.00,4418318.00,1418318.00,0.47
84.149,Migrant Education_College Assistance Migrant Program,2010,Department of Education,16536229.00,16461777.00,-74452.00,0.00
84.153,Business and International Education Projects,2010,Department of Education,4501048.00,4860442.00,359394.00,0.08
84.160,Training Interpreters for Individuals who are Deaf and Individuals who are Deaf-Blind,2010,Department of Education,2096000.00,2099978.00,3978.00,0.00
84.165,Magnet Schools Assistance,2010,Department of Education,100000000.00,97561416.00,-2438584.00,-0.02
84.170,Javits Fellowships,2010,Department of Education,9687000.00,9539949.00,-147051.00,-0.02
84.184,Safe and Drug-Free Schools and Communities_National Programs,2010,Department of Education,224053000.00,277830392.00,53777392.00,0.24
84.191,Adult Education_National Leadership Activities,2010,Department of Education,11346000.00,,-11346000.00,-1.00
84.200,Graduate Assistance in Areas of National Need,2010,Department of Education,31030000.00,30759765.00,-270235.00,-0.01
84.206,Javits Gifted and Talented Students Education Grant Program,2010,Department of Education,7463000.00,5492386.00,-1970614.00,-0.26
84.214,Even Start_Migrant Education,2010,Department of Education,1993650.00,1269176.00,-724474.00,-0.36
84.215,Fund for the Improvement of Education,2010,Department of Education,382632000.00,543968512.00,161336512.00,0.42
84.217,TRIO_McNair Post-Baccalaureate Achievement,2010,Department of Education,47594000.00,47373968.00,-220032.00,0.00
84.220,Centers for International Business Education,2010,Department of Education,12757000.00,12757000.00,0.00,0.00
84.229,Language Resource Centers,2010,Department of Education,5022000.00,5022000.00,0.00,0.00
84.234,Projects with Industry,2010,Department of Education,19197000.00,17842595.00,-1354405.00,-0.07
84.235,Rehabilitation Services Demonstration and Training Programs,2010,Department of Education,6506000.00,11487597.00,4981597.00,0.77
84.245,Tribally Controlled Postsecondary Career and Technical Institutions ,2010,Department of Education,8162000.00,8162000.00,0.00,0.00
84.246,Rehabilitation Short-Term Training,2010,Department of Education,750000.00,449993.00,-300007.00,-0.40
84.250,Rehabilitation Services_American Indians with Disabilities,2010,Department of Education,37449000.00,42822201.00,5373201.00,0.14
84.256,Freely Associated States_Education Grant Program,2010,Department of Education,3701828.00,3694491.00,-7337.00,0.00
84.258,Even Start_Indian Tribes and Tribal Organizations,2010,Department of Education,996810.00,766605.00,-230205.00,-0.23
84.259,Native Hawaiian Career and Technical Education,2010,Department of Education,2902000.00,2902278.00,278.00,0.00
84.263,Rehabilitation Training_Experimental and Innovative Training,2010,Department of Education,500000.00,,-500000.00,-1.00
84.264,Rehabilitation Training_Continuing Education,2010,Department of Education,8224550.00,10674391.00,2449841.00,0.30
84.265,Rehabilitation Training_State Vocational Rehabilitation Unit In-Service Training,2010,Department of Education,5664900.00,5646017.00,-18883.00,0.00
84.269,Institute for International Public Policy,2010,Department of Education,1945000.00,1926630.00,-18370.00,-0.01
84.274,American Overseas Research Centers,2010,Department of Education,1197122.00,1197000.00,-122.00,0.00
84.275,Rehabilitation Training_General Training,2010,Department of Education,300000.00,460000.00,160000.00,0.53
84.282,Charter Schools,2010,Department of Education,216031000.00,251283765.00,35252765.00,0.16
84.283,Comprehensive Centers,2010,Department of Education,56313000.00,59313000.00,3000000.00,0.05
84.286,Ready to Teach,2010,Department of Education,0.00,,0.00,0.00
84.293,Foreign Language Assistance,2010,Department of Education,26928000.00,26896200.00,-31800.00,0.00
84.295,Ready-To-Learn Television,2010,Department of Education,27248000.00,27250829.00,2829.00,0.00
84.299,Indian Education -- Special Programs for Indian Children,2010,Department of Education,19060000.00,18891942.00,-168058.00,-0.01
84.304,Civic Education - Cooperative Education Exchange Program,2010,Department of Education,35000000.00,34990000.00,-10000.00,0.00
84.305,"Education Research, Development and Dissemination",2010,Department of Education,154000000.00,173094573.00,19094573.00,0.12
84.310,Parental Information and Resource Centers,2010,Department of Education,39254000.00,37588992.00,-1665008.00,-0.04
84.315,Capacity Building for Traditionally Underserved Populations,2010,Department of Education,2403250.00,2272453.00,-130797.00,-0.05
84.323,Special Education - State Personnel Development,2010,Department of Education,48000000.00,47981069.00,-18931.00,0.00
84.324,Research in Special Education,2010,Department of Education,65795000.00,68957979.00,3162979.00,0.05
84.325,Special Education - Personnel Development to Improve Services and Results for Children with Disabilities,2010,Department of Education,90653000.00,90382760.00,-270240.00,0.00
84.326,Special Education_Technical Assistance and Dissemination to Improve Services and Results for Children with Disabilities,2010,Department of Education,49549000.00,46549538.00,-2999462.00,-0.06
84.327,Special Education_Technology and Media Services for Individuals with Disabilities,2010,Department of Education,43973000.00,47229883.00,3256883.00,0.07
84.328,Special Education_Parent Information Centers,2010,Department of Education,28028000.00,32339060.00,4311060.00,0.15
84.329,Special Education_Studies and Evaluations,2010,Department of Education,11460000.00,,-11460000.00,-1.00
84.330,Advanced Placement Program (Advanced Placement Test Fee; Advanced Placement Incentive Program Grants),2010,Department of Education,45840000.00,45344546.00,-495454.00,-0.01
84.333,"Demonstration Projects to Support Postsecondary Faculty, Staff, and Administrations in Educating Students with Disabilities",2010,Department of Education,6755000.00,6755000.00,0.00,0.00
84.334,Gaining Early Awareness and Readiness for Undergraduate Programs,2010,Department of Education,323212000.00,321291018.00,-1920982.00,-0.01
84.335,Child Care Access Means Parents in School,2010,Department of Education,16034000.00,16034000.00,0.00,0.00
84.336,Teacher Quality Enhancement Grants,2010,Department of Education,43000000.00,44107171.00,1107171.00,0.03
84.337,International Education_Technological Innovation and Cooperation for Foreign Information Access,2010,Department of Education,2108169.00,2108169.00,0.00,0.00
84.345,Underground Railroad Educational and Cultural Program,2010,Department of Education,1945000.00,1153352.00,-791648.00,-0.41
84.350,Transition to Teaching,2010,Department of Education,43707000.00,42443271.00,-1263729.00,-0.03
84.351,Arts in Education,2010,Department of Education,40000000.00,38783302.00,-1216698.00,-0.03
84.354,Credit Enhancement for Charter School Facilities,2010,Department of Education,8300000.00,10013427.00,1713427.00,0.21
84.356,Alaska Native Educational Programs,2010,Department of Education,33315000.00,33314640.00,-360.00,0.00
84.359,Early Reading First,2010,Department of Education,0.00,,0.00,0.00
84.360,School Dropout Prevention Program,2010,Department of Education,50000000.00,46716552.00,-3283448.00,-0.07
84.361,Voluntary Public School Choice,2010,Department of Education,25819000.00,24913252.00,-905748.00,-0.04
84.362,Native Hawaiian Education,2010,Department of Education,34315000.00,34125000.00,-190000.00,-0.01
84.363,School Leadership,2010,Department of Education,29220000.00,33038886.00,3818886.00,0.13
84.364,Literacy through School Libraries,2010,Department of Education,19145000.00,18666375.00,-478625.00,-0.02
84.366,Mathematics and Science Partnerships,2010,Department of Education,180478000.00,175984098.00,-4493902.00,-0.02
84.368,Grants for Enhanced Assessment Instruments,2010,Department of Education,10732000.00,10674000.00,-58000.00,-0.01
84.370,DC School Choice Incentive Program ,2010,Department of Education,13200000.00,19668215.00,6468215.00,0.49
84.372,Statewide Data Systems,2010,Department of Education,48500000.00,40785136.00,-7714864.00,-0.16
84.373,Special Education_Technical Assistance on State Data Collection,2010,Department of Education,25000000.00,25250000.00,250000.00,0.01
84.374,Teacher Incentive Fund,2010,Department of Education,400000000.00,384389403.00,-15610597.00,-0.04
84.380,Special Education -- Olympic Education Programs,2010,Department of Education,8095000.00,8095000.00,0.00,0.00
84.381,"Baccalaureate Degrees in Science, Technology, Engineering, Mathematics, and Critical Foreign Languages and Master's Degrees in Science, Technology, Engineering, Mathematics, and Critical Foreign Languages",2010,Department of Education,2184000.00,2093227.00,-90773.00,-0.04
84.382,Strengthening Minority-Serving Institutions,2010,Department of Education,25000000.00,12527702.00,-12472298.00,-0.50
84.384,"Statewide Data Systems, Recovery Act",2010,Department of Education,0.00,249999967.00,249999967.00,
84.395,"State Fiscal Stabilization Fund (SFSF) - Race-to-the-Top Incentive Grants, Recovery Act",2010,Department of Education,0.00,4302573180.00,4302573180.00,
84.396,"State Fiscal Stabilization Fund (SFSF) - What Works and Innovation Fund, Recovery Act",2010,Department of Education,650000000.00,645978395.00,-4021605.00,-0.01
84.400,"Centers for Independent Living, Recovery Act.",2010,Department of Education,0.00,86527523.00,86527523.00,
84.401,"Impact Aid School Construction, Recovery Act",2010,Department of Education,0.00,59828355.00,59828355.00,
84.405,"Teacher Quality Partnerships, Recovery Act ",2010,Department of Education,0.00,99832177.00,99832177.00,
84.406,"Capacity Building for Traditionally Underserved Populations, Recovery Act. ",2010,Department of Education,1400000.00,1386597.00,-13403.00,-0.01
84.407,Transition Programs for Students with Intellectual Disabilities into Higher Education,2010,Department of Education,11000000.00,10894002.00,-105998.00,-0.01
85.102,Christopher Columbus Awards,2010,Various Scholarship and Fellowship Foundations,265000.00,,-265000.00,-1.00
85.401,Morris K. Udall Fellowship Program,2010,Various Scholarship and Fellowship Foundations,48000.00,,-48000.00,-1.00
89.003,National Historical Publications and Records Grants,2010,National Archives and Records Administration,13000000.00,2649028.00,-10350972.00,-0.80
90.100,Denali Commission Program,2010,"Denali Commission, Delta Regional Authority, Japan US Friendship Commission, US Election Assistance Commission, Broadcasting Board of Governors",54201687.00,49806408.00,-4395279.00,-0.08
90.300,Japan-US Friendship Commission Grants,2010,"Denali Commission, Delta Regional Authority, Japan US Friendship Commission, US Election Assistance Commission, Broadcasting Board of Governors",1600000.00,,-1600000.00,-1.00
90.400,Help America Vote College Program,2010,"Denali Commission, Delta Regional Authority, Japan US Friendship Commission, US Election Assistance Commission, Broadcasting Board of Governors",750000.00,750000.00,0.00,0.00
90.403,U.S. Election Assistance Commission Research Grants,2010,"Denali Commission, Delta Regional Authority, Japan US Friendship Commission, US Election Assistance Commission, Broadcasting Board of Governors",8000000.00,500000.00,-7500000.00,-0.94
91.001,Unsolicited Grant Program,2010,United States Institute of Peace,1900000.00,,-1900000.00,-1.00
91.002,Solicited Grant Program,2010,United States Institute of Peace,2800000.00,,-2800000.00,-1.00
93.018,Strengthening Public Health Services at the Outreach Offices of the U.S.-Mexico Border Health Commission,2010,Department of Health and Human Services,2600000.00,1465000.00,-1135000.00,-0.44
93.047,"Special Programs for the Aging_Title VI, Part A, Grants to Indian Tribes_Part B, Grants to Native Hawaiians",2010,Department of Health and Human Services,28000000.00,26933808.00,-1066192.00,-0.04
93.048,Special Programs for the Aging_Title IV_and Title II_Discretionary Projects,2010,Department of Health and Human Services,63296635.00,70758533.00,7461898.00,0.12
93.051,Alzheimer's Disease Demonstration Grants to States,2010,Department of Health and Human Services,11462000.00,10140162.00,-1321838.00,-0.12
93.054,"National Family Caregiver Support, Title VI, Part C, Grants To Indian Tribes And Native Hawaiians",2010,Department of Health and Human Services,6000000.00,6372917.00,372917.00,0.06
93.064,"Laboratory Training, Evaluation, and Quality Assurance Programs",2010,Department of Health and Human Services,3348718.00,1989703.00,-1359015.00,-0.41
93.069,Public Health Emergency Preparedness,2010,Department of Health and Human Services,688259211.00,778039824.00,89780613.00,0.13
93.086,Healthy Marriage Promotion and Responsible Fatherhood Grants,2010,Department of Health and Human Services,150000000.00,113056821.00,-36943179.00,-0.25
93.087,Enhance the Safety of Children Affected by Parental Methamphetamine or Other Substance Abuse,2010,Department of Health and Human Services,19500000.00,23001042.00,3501042.00,0.18
93.088,Advancing System Improvements to Support Targets for Healthy People 2010,2010,Department of Health and Human Services,4000000.00,4976337.00,976337.00,0.24
93.089,Emergency System for Advance Registration of Volunteer Health Professionals,2010,Department of Health and Human Services,3672000.00,3794980.00,122980.00,0.03
93.091,Social Services and Income Maintenance Benefits Enrollment Coordination Grants,2010,Department of Health and Human Services,2000000.00,,-2000000.00,-1.00
93.103,Food and Drug Administration_Research,2010,Department of Health and Human Services,40598329.00,52133423.00,11535094.00,0.28
93.104,Comprehensive Community Mental Health Services for Children with Serious Emotional Disturbances (SED),2010,Department of Health and Human Services,76640280.00,87743974.00,11103694.00,0.14
93.110,Maternal and Child Health Federal Consolidated Programs,2010,Department of Health and Human Services,142000000.00,150492485.00,8492485.00,0.06
93.113,Environmental Health,2010,Department of Health and Human Services,335327000.00,358019890.00,22692890.00,0.07
93.116,Project Grants and Cooperative Agreements for Tuberculosis Control Programs,2010,Department of Health and Human Services,99043905.00,97708440.00,-1335465.00,-0.01
93.117,Grants for Preventive Medicine,2010,Department of Health and Human Services,2365000.00,2831147.00,466147.00,0.20
93.123,Health Professions Pregraduate Scholarship Program for Indians,2010,Department of Health and Human Services,1364846.00,,-1364846.00,-1.00
93.129,Technical and Non-Financial Assistance to Health Centers,2010,Department of Health and Human Services,42000000.00,37943365.00,-4056635.00,-0.10
93.130,Cooperative Agreements to States/Territories for the Coordination and Development of Primary Care Offices,2010,Department of Health and Human Services,20000000.00,9078191.00,-10921809.00,-0.55
93.134,Grants to Increase Organ Donations,2010,Department of Health and Human Services,7297099.00,7799804.00,502705.00,0.07
93.135,Centers for Research and Demonstration for Health Promotion and Disease Prevention,2010,Department of Health and Human Services,38836650.00,50307018.00,11470368.00,0.30
93.142,NIEHS Hazardous Waste Worker Health and Safety Training,2010,Department of Health and Human Services,27171000.00,36909738.00,9738738.00,0.36
