Program Number,Program Name,Fiscal Year,Agency,CFDA Obligations,USASpending Obligations,Delta,Percent under/over reported
17.504,Consultation Agreements,2009,Department of Labor,54531000.00,31171697.00,-23359303.00,-0.43
17.505,OSHA Data Initiative,2009,Department of Labor,1321000.00,721205.00,-599795.00,-0.45
17.600,Mine Health and Safety Grants,2009,Department of Labor,8441000.00,8225758.00,-215242.00,-0.03
17.603,Brookwood-Sago Grant,2009,Department of Labor,500000.00,410000.00,-90000.00,-0.18
17.604,Safety and Health Grants,2009,Department of Labor,1808000.00,,-1808000.00,-1.00
17.802,Veterans' Employment Program,2009,Department of Labor,7568149.00,,-7568149.00,-1.00
17.805,Homeless Veterans Reintegration Project,2009,Department of Labor,22590188.00,26353485.00,3763297.00,0.17
19.011,ACADEMIC EXCHANGE PROGRAMS - SPECIAL ACADEMIC EXCHANGE PROGRAMS,2009,U.S. Department of State,33602000.00,22573565.00,-11028435.00,-0.33
19.012,Professional and Cultural Exchange Programs - Special Professional and Cultural Programs,2009,U.S. Department of State,11663000.00,6321089.00,-5341911.00,-0.46
19.017,Environmental and Scientific Partnerships and Programs,2009,U.S. Department of State,32000000.00,2300.00,-31997700.00,-1.00
19.019,International Programs to Combat Human Trafficking,2009,U.S. Department of State,21000000.00,15103910.00,-5896090.00,-0.28
19.022,Educational and Cultural Exchange Programs Appropriation Overseas Grants,2009,U.S. Department of State,10000000.00,,-10000000.00,-1.00
19.025,U.S. Ambassadors Fund for Cultural Preservation,2009,U.S. Department of State,5228000.00,49800.00,-5178200.00,-0.99
19.345,"International Programs to Support Democracy, Human Rights and Labor",2009,U.S. Department of State,79000000.00,,-79000000.00,-1.00
19.511,Overseas Refugee Assistance Programs for East Asia,2009,U.S. Department of State,37000000.00,13097787.00,-23902213.00,-0.65
19.517,Overseas Refugee Assistance Programs for Africa,2009,U.S. Department of State,354000000.00,650462805.00,296462805.00,0.84
19.518,Overseas Refugee Assistance Programs for Western Hemisphere,2009,U.S. Department of State,46000000.00,14219594.00,-31780406.00,-0.69
19.520,Overseas Refugee Assistance Programs for Europe,2009,U.S. Department of State,65000000.00,19050309.00,-45949691.00,-0.71
19.522,Overseas Refugee Assistance Programs for Strategic Global Priorities,2009,U.S. Department of State,98000000.00,32437632.00,-65562368.00,-0.67
20.215,Highway Training and Education,2009,Department of Transportation,13451420.00,,-13451420.00,-1.00
20.232,Commercial Driver License State Programs,2009,Department of Transportation,25000000.00,,-25000000.00,-1.00
20.233,Border Enforcement Grants,2009,Department of Transportation,32000000.00,,-32000000.00,-1.00
20.234,Safety Data Improvement Program,2009,Department of Transportation,3000000.00,335479.00,-2664521.00,-0.89
20.237,Commercial Vehicle Information Systems and Networks,2009,Department of Transportation,22500000.00,2497580.00,-20002420.00,-0.89
20.238,Commercial Drivers License Information System ,2009,Department of Transportation,8000000.00,,-8000000.00,-1.00
20.240,Fuel Tax Evasion-Intergovernmental Enforcement Effort,2009,Department of Transportation,1000000.00,,-1000000.00,-1.00
20.313,Railroad Research and Development,2009,Department of Transportation,6889000.00,2515180.00,-4373820.00,-0.63
20.314,Railroad Development,2009,Department of Transportation,10604849.00,1874710.00,-8730139.00,-0.82
20.317,Capital Assistance to States - Intercity Passenger Rail Service,2009,Department of Transportation,28107927.00,1550000.00,-26557927.00,-0.94
20.318,Maglev Project Selection Program - SAFETEA-LU,2009,Department of Transportation,890000.00,,-890000.00,-1.00
20.320,Rail Line Relocation and Improvement ,2009,Department of Transportation,39200000.00,,-39200000.00,-1.00
20.514,Public Transportation Research,2009,Department of Transportation,15000000.00,31809547.00,16809547.00,1.12
20.516,Job Access_Reverse Commute,2009,Department of Transportation,136113000.00,91912469.00,-44200531.00,-0.32
20.518,Capital and Training Assistance Program for Over-the-Road Bus Accessibility,2009,Department of Transportation,15003000.00,8990813.00,-6012187.00,-0.40
20.519,Clean Fuels,2009,Department of Transportation,104056000.00,28678478.00,-75377522.00,-0.72
20.520,Paul S. Sarbanes Transit in the Parks,2009,Department of Transportation,11748000.00,5355099.00,-6392901.00,-0.54
20.522,Alternatives Analysis ,2009,Department of Transportation,11271000.00,4915000.00,-6356000.00,-0.56
20.523,Capital Assistance Program for Reducing Energy Consumption and Greenhouse Gas Emissions,2009,Department of Transportation,100000000.00,,-100000000.00,-1.00
20.601,Alcohol Traffic Safety and Drunk Driving Prevention Incentive Grants,2009,Department of Transportation,138500000.00,138500000.00,0.00,0.00
20.602,Occupant Protection,2009,Department of Transportation,25000000.00,25000000.00,0.00,0.00
20.607,Alcohol Open Container Requirements,2009,Department of Transportation,103121656.00,28547055.00,-74574601.00,-0.72
20.608,Minimum Penalties for Repeat Offenders for Driving While Intoxicated,2009,Department of Transportation,137572128.00,42700950.00,-94871178.00,-0.69
20.609,Safety Belt Performance Grants,2009,Department of Transportation,69807597.00,26588837.00,-43218760.00,-0.62
20.610,State Traffic Safety Information System Improvement Grants,2009,Department of Transportation,34500000.00,,-34500000.00,-1.00
20.611,Incentive Grant Program to Prohibit Racial Profiling,2009,Department of Transportation,2674178.00,2674176.00,-2.00,0.00
20.612,Incentive Grant Program to Increase Motorcyclist Safety,2009,Department of Transportation,7000000.00,7000000.00,0.00,0.00
20.613,Child Safety and Child Booster Seats Incentive Grants,2009,Department of Transportation,7000000.00,92185.00,-6907815.00,-0.99
20.614,National Highway Transportation Safety Administration (NHTSA) Discretionary Safety Grants,2009,Department of Transportation,40000000.00,398069.00,-39601931.00,-0.99
20.701,University Transportation Centers Program,2009,Department of Transportation,80850400.00,87033900.00,6183500.00,0.08
20.703,Interagency Hazardous Materials Public Sector Training and Planning Grants,2009,Department of Transportation,26112620.00,,-26112620.00,-1.00
20.710,Technical Assistance Grants,2009,Department of Transportation,1000000.00,,-1000000.00,-1.00
20.720,State Damage Prevention Program Grants,2009,Department of Transportation,1047000.00,99462.00,-947538.00,-0.91
20.721,PHMSA Pipeline Safety Program One Call Grant,2009,Department of Transportation,1043000.00,70414.00,-972586.00,-0.93
20.722,Technology Development Grant,2009,Department of Transportation,500000.00,,-500000.00,-1.00
20.761,Biobased Transportation Research,2009,Department of Transportation,11466000.00,,-11466000.00,-1.00
20.762,Research Grants,2009,Department of Transportation,500000.00,,-500000.00,-1.00
20.764,Hydrogen Storage Research and Development,2009,Department of Transportation,500000.00,,-500000.00,-1.00
20.815,Fireboat Construction,2009,Department of Transportation,993500.00,,-993500.00,-1.00
20.910,Assistance to small and disadvantaged businesses,2009,Department of Transportation,1352547000.00,135000.00,-1352412000.00,-1.00
20.930,Payments for Small Community Air Service Development,2009,Department of Transportation,10000000.00,,-10000000.00,-1.00
20.931,"Transportation Planning, Research and Education",2009,Department of Transportation,5300000.00,,-5300000.00,-1.00
21.006,Tax Counseling for the Elderly,2009,Department of the Treasury,3950000.00,5100415.00,1150415.00,0.29
21.008,Low-Income Taxpayer Clinics,2009,Department of the Treasury,9500000.00,9493921.00,-6079.00,0.00
21.010,Financial Education and Counseling Pilot Program,2009,Department of the Treasury,0.00,,0.00,0.00
21.011,Capital Magnet Fund,2009,Department of the Treasury,0.00,,0.00,0.00
21.013,Qualifying Therapeutic Discovery Project Credit,2009,Department of the Treasury,0.00,,0.00,0.00
21.020,Community Development Financial Institutions Program,2009,Department of the Treasury,155000000.00,168428490.00,13428490.00,0.09
21.021,Bank Enterprise Award Program,2009,Department of the Treasury,22000000.00,22332326.00,332326.00,0.02
23.001,Appalachian Regional Development (See individual Appalachian Programs),2009,Appalachian Regional Commission,65451568.00,,-65451568.00,-1.00
23.002,Appalachian Area Development,2009,Appalachian Regional Commission,65451568.00,,-65451568.00,-1.00
23.003,Appalachian Development Highway System,2009,Appalachian Regional Commission,375672092.00,,-375672092.00,-1.00
23.009,Appalachian Local Development District Assistance,2009,Appalachian Regional Commission,6705018.00,,-6705018.00,-1.00
23.011,"Appalachian Research, Technical Assistance, and Demonstration Projects",2009,Appalachian Regional Commission,1290750.00,,-1290750.00,-1.00
34.002,Labor Management Cooperation,2009,Federal Mediation and Concillation Service,665192.00,,-665192.00,-1.00
45.024,Promotion of the Arts_Grants to Organizations and Individuals,2009,National Endowment for the Arts,98970658.00,81446402.00,-17524256.00,-0.18
45.130,Promotion of the Humanities_Challenge Grants,2009,National Endowment for the Arts,10575803.00,9921287.00,-654516.00,-0.06
45.149,Promotion of the Humanities_Division of Preservation and Access,2009,National Endowment for the Arts,13861000.00,18931129.00,5070129.00,0.37
45.160,Promotion of the Humanities_Fellowships and Stipends,2009,National Endowment for the Arts,4351200.00,,-4351200.00,-1.00
45.161,Promotion of the Humanities_Research,2009,National Endowment for the Arts,11754752.00,11854127.00,99375.00,0.01
45.162,Promotion of the Humanities_Teaching and Learning Resources and Curriculum Development,2009,National Endowment for the Arts,1322224.00,898193.00,-424031.00,-0.32
45.163,Promotion of the Humanities_Professional Development,2009,National Endowment for the Arts,15967506.00,14987377.00,-980129.00,-0.06
45.164,Promotion of the Humanities_Public Programs,2009,National Endowment for the Arts,17790357.00,15660142.00,-2130215.00,-0.12
45.168,Promotion of the Humanities_We the People,2009,National Endowment for the Arts,7087790.00,9329211.00,2241421.00,0.32
45.169,Promotion of the Humanities_Office of Digital Humanities,2009,National Endowment for the Arts,3193657.00,2911694.00,-281963.00,-0.09
45.301,Museums for America,2009,National Endowment for the Arts,22165000.00,19176000.00,-2989000.00,-0.13
45.303,Conservation Project Support,2009,National Endowment for the Arts,3801000.00,3147056.00,-653944.00,-0.17
45.307,21st Century Museum Professionals,2009,National Endowment for the Arts,2141000.00,1780000.00,-361000.00,-0.17
45.308,Native American/Native Hawaiian Museum Services Program ,2009,National Endowment for the Arts,945000.00,1028035.00,83035.00,0.09
45.309,Museum Grants for African American History and Culture,2009,National Endowment for the Arts,1350000.00,1310000.00,-40000.00,-0.03
45.311,Native American and Native Hawaiian Library Services,2009,National Endowment for the Arts,3717000.00,3967312.00,250312.00,0.07
45.312,National Leadership Grants,2009,National Endowment for the Arts,20925000.00,29865807.00,8940807.00,0.43
45.313,Laura Bush 21st Century Librarian Program,2009,National Endowment for the Arts,26500000.00,22503899.00,-3996101.00,-0.15
47.082,TRANS-NSF RECOVERY ACT RESEARCH SUPPORT,2009,National Science Foundation,3002000000.00,2350554410.00,-651445590.00,-0.22
59.007,7(j) Technical Assistance,2009,Small Business Administraton,3756000.00,,-3756000.00,-1.00
59.037,Small Business Development Centers,2009,Small Business Administraton,101600000.00,5788179.00,-95811821.00,-0.94
59.043,Women's Business Ownership Assistance,2009,Small Business Administraton,21601000.00,,-21601000.00,-1.00
59.044,Veterans Business Development,2009,Small Business Administraton,5463000.00,,-5463000.00,-1.00
59.050,PRIME Technical Assistance,2009,Small Business Administraton,0.00,,0.00,0.00
59.051,New Markets Venture Capital Program,2009,Small Business Administraton,251000.00,,-251000.00,-1.00
59.052,Native American Outreach,2009,Small Business Administraton,1685000.00,,-1685000.00,-1.00
59.055,HUBZone Program,2009,Small Business Administraton,8150000.00,,-8150000.00,-1.00
59.070,Drug-Free Workplace Program,2009,Small Business Administraton,1098000.00,,-1098000.00,-1.00
64.005,Grants to States for Construction of State Home Facilities,2009,Department of Veterans Affairs,257299000.00,142511870.00,-114787130.00,-0.45
64.024,VA Homeless Providers Grant and Per Diem Program,2009,Department of Veterans Affairs,122000000.00,,-122000000.00,-1.00
64.026,Veterans State Adult Day Health Care,2009,Department of Veterans Affairs,399000.00,,-399000.00,-1.00
64.203,State Cemetery Grants,2009,Department of Veterans Affairs,43500000.00,,-43500000.00,-1.00
66.001,Air Pollution Control Program Support,2009,Environmental Protection Agency,176593000.00,84007953.00,-92585047.00,-0.52
66.032,State Indoor Radon Grants,2009,Environmental Protection Agency,8074000.00,7113873.00,-960127.00,-0.12
66.033,Ozone Transport Commission,2009,Environmental Protection Agency,635000.00,639000.00,4000.00,0.01
66.034,"Surveys, Studies, Research, Investigations, Demonstrations, and Special Purpose Activities Relating to the Clean Air Act",2009,Environmental Protection Agency,9161000.00,55067825.00,45906825.00,5.01
66.035,Community Action for a Renewed Environment (CARE) Program,2009,Environmental Protection Agency,2049297.00,2724522.00,675225.00,0.33
66.036,Clean School Bus USA,2009,Environmental Protection Agency,0.00,45262.00,45262.00,
66.037,"Internships, Training and Workshops for the Office of Air and Radiation",2009,Environmental Protection Agency,100298.00,60000.00,-40298.00,-0.40
66.038,"Training, Investigations, and Special Purpose Activities of Federally-Recognized Indian Tribes Consistent With the Clean Air Act (CAA), Tribal Sovereignty and the Protection and Management of Air Quality",2009,Environmental Protection Agency,13300000.00,5197380.00,-8102620.00,-0.61
66.039,National Clean Diesel Funding Assistance Program,2009,Environmental Protection Agency,247800000.00,231863360.00,-15936640.00,-0.06
66.041,Climate Showcase Communities Grant Program,2009,Environmental Protection Agency,10000000.00,,-10000000.00,-1.00
66.042,Temporally Integrated Monitoring of Ecosystems (TIME) and Long-Term Monitoring (LTM) Program,2009,Environmental Protection Agency,0.00,,0.00,0.00
66.050,Potomac Highlands Implementation Grants ,2009,Environmental Protection Agency,0.00,,0.00,0.00
66.110,Healthy Communities Grant Program,2009,Environmental Protection Agency,380800.00,296847.00,-83953.00,-0.22
66.111,Regional Environmental Priority Projects,2009,Environmental Protection Agency,0.00,,0.00,0.00
66.113,Region 3 Environmental Priority Projects ,2009,Environmental Protection Agency,6500.00,6500.00,0.00,0.00
66.117,Region 9 multi-media and geographic priority projects,2009,Environmental Protection Agency,0.00,,0.00,0.00
66.119,West Coast Estuaries Initiative,2009,Environmental Protection Agency,2800000.00,,-2800000.00,-1.00
66.123,Puget Sound Action Agenda: Technical Investigations and Implementation Assistance Program ,2009,Environmental Protection Agency,0.00,,0.00,0.00
66.202,Congressionally Mandated Projects,2009,Environmental Protection Agency,198400000.00,185551053.00,-12848947.00,-0.06
66.203,Environmental Finance Center Grants,2009,Environmental Protection Agency,2000000.00,666666.00,-1333334.00,-0.67
66.305,Compliance Assistance Support for Services to the Regulated Community and Other Assistance Providers ,2009,Environmental Protection Agency,0.00,340000.00,340000.00,
66.306,Environmental Justice Collaborative Problem-Solving Cooperative Agreement Program,2009,Environmental Protection Agency,0.00,,0.00,0.00
66.309,"Surveys, Studies, Investigations and Special Purpose Activities Relating to Environmental Justice",2009,Environmental Protection Agency,15000.00,15000.00,0.00,0.00
66.310,Capacity Building Grants and Cooperative Agreements for Compliance Assurance and Enforcement Activities in Indian Country and Other Tribal Areas,2009,Environmental Protection Agency,300000.00,140000.00,-160000.00,-0.53
66.312,State Environmental Justice Cooperative Agreement Program,2009,Environmental Protection Agency,800000.00,800000.00,0.00,0.00
66.418,Construction Grants for Wastewater Treatment Works,2009,Environmental Protection Agency,68712600.00,29364407.00,-39348193.00,-0.57
66.424,"Surveys, Studies, Investigations, Demonstrations, and Training Grants - Section 1442 of the Safe Drinking Water Act",2009,Environmental Protection Agency,3622582.00,1979666.00,-1642916.00,-0.45
66.436,"Surveys, Studies, Investigations, Demonstrations, and Training Grants and Cooperative Agreements - Section 104(b)(3) of the Clean Water Act",2009,Environmental Protection Agency,4342878.00,10092461.00,5749583.00,1.32
66.437,Long Island Sound Program ,2009,Environmental Protection Agency,3370258.00,3598809.00,228551.00,0.07
66.439,Targeted Watersheds Grants,2009,Environmental Protection Agency,7400000.00,8929548.00,1529548.00,0.21
66.456,National Estuary Program,2009,Environmental Protection Agency,17524300.00,26451122.00,8926822.00,0.51
66.461,Regional Wetland Program Development Grants,2009,Environmental Protection Agency,14845000.00,10718753.00,-4126247.00,-0.28
66.462,National Wetland Program Development Grants and Five-Star Restoration Training Grant,2009,Environmental Protection Agency,3600000.00,1342190.00,-2257810.00,-0.63
66.463,Water Quality Cooperative Agreements,2009,Environmental Protection Agency,14000.00,14000.00,0.00,0.00
66.466,Chesapeake Bay Program,2009,Environmental Protection Agency,45410404.00,16330935.00,-29079469.00,-0.64
66.467,Wastewater Operator Training Grant Program (Technical Assistance),2009,Environmental Protection Agency,23300.00,23310.00,10.00,0.00
66.469,Great Lakes Program,2009,Environmental Protection Agency,86600000.00,6756409.00,-79843591.00,-0.92
66.473,Direct Implementation Tribal Cooperative Agreements,2009,Environmental Protection Agency,1160542.00,1119624.00,-40918.00,-0.04
66.475,Gulf of Mexico Program,2009,Environmental Protection Agency,1759000.00,2688021.00,929021.00,0.53
66.478,Water Security Training and Technical Assistance and Water Security Initiative Contamination Warning System Pilots,2009,Environmental Protection Agency,23000000.00,11500000.00,-11500000.00,-0.50
66.479,Wetland Program Grants -  State/Tribal Environmental Outcome Wetland Demonstration Program,2009,Environmental Protection Agency,0.00,266979.00,266979.00,
66.480,Assessment and Watershed Protection Program Grants ,2009,Environmental Protection Agency,750000.00,570172.00,-179828.00,-0.24
66.481,Lake Champlain Basin Program,2009,Environmental Protection Agency,3147500.00,1629090.00,-1518410.00,-0.48
66.508,Senior Environmental Employment Program,2009,Environmental Protection Agency,56423981.00,55103399.00,-1320582.00,-0.02
66.509,Science To Achieve Results (STAR) Research Program,2009,Environmental Protection Agency,50600000.00,47934812.00,-2665188.00,-0.05
66.510,"Surveys, Studies, Investigations and Special Purpose Grants within the Office of Research and Development",2009,Environmental Protection Agency,3200000.00,5159003.00,1959003.00,0.61
66.511,Office of Research and Development Consolidated Research/Training/Fellowships,2009,Environmental Protection Agency,17100000.00,13351990.00,-3748010.00,-0.22
66.512,Regional Environmental Monitoring and Assessment Program (REMAP) Research Projects,2009,Environmental Protection Agency,390141.00,1148604.00,758463.00,1.94
66.513,Greater Research Opportunities (GRO) Fellowships For Undergraduate/Graduate Environmental Study,2009,Environmental Protection Agency,1900000.00,,-1900000.00,-1.00
66.514,Science To Achieve Results (STAR) Fellowship Program ,2009,Environmental Protection Agency,4900000.00,,-4900000.00,-1.00
66.516,P3 Award: National Student Design Competition for Sustainability,2009,Environmental Protection Agency,1100000.00,1004309.00,-95691.00,-0.09
66.517,Regional Applied Research Efforts (RARE) ,2009,Environmental Protection Agency,459582.00,30000.00,-429582.00,-0.93
66.518,State Senior Environmental Employment Program,2009,Environmental Protection Agency,570000.00,83900.00,-486100.00,-0.85
66.600,Environmental Protection Consolidated Grants for the Insular Areas - Program Support,2009,Environmental Protection Agency,7670000.00,5739651.00,-1930349.00,-0.25
66.604,Environmental Justice Small Grant Program ,2009,Environmental Protection Agency,0.00,,0.00,0.00
66.608,Environmental Information Exchange Network Grant Program and Related Assistance,2009,Environmental Protection Agency,11360000.00,11888047.00,528047.00,0.05
66.609,Protection of Children and Older Adults (Elderly) from Environmental Health Risks,2009,Environmental Protection Agency,100000.00,210000.00,110000.00,1.10
66.610,"Surveys, Studies, Investigations and Special Purpose Grants within the Office of the Administrator",2009,Environmental Protection Agency,302150.00,110000.00,-192150.00,-0.64
66.611,Environmental Policy and Innovation Grants,2009,Environmental Protection Agency,816000.00,1555885.00,739885.00,0.91
66.612,"Surveys, Studies, Investigations, Training Demonstrations and Educational Outreach Related to Environmental Information and the Release of Toxic Chemicals  ",2009,Environmental Protection Agency,200000.00,210000.00,10000.00,0.05
66.700,Consolidated Pesticide Enforcement Cooperative Agreements,2009,Environmental Protection Agency,18711000.00,11531945.00,-7179055.00,-0.38
66.701,Toxic Substances Compliance Monitoring Cooperative Agreements,2009,Environmental Protection Agency,5099000.00,2419284.00,-2679716.00,-0.53
66.707,TSCA Title IV State Lead Grants Certification of Lead-Based Paint Professionals,2009,Environmental Protection Agency,13564000.00,10891392.00,-2672608.00,-0.20
66.708,Pollution Prevention Grants Program,2009,Environmental Protection Agency,4940000.00,4268709.00,-671291.00,-0.14
66.709,Multi-Media Capacity Building Grants for States and Tribes,2009,Environmental Protection Agency,2717600.00,2656447.00,-61153.00,-0.02
66.714,Pesticide Environmental Stewardship Regional Grants ,2009,Environmental Protection Agency,421260.00,228979.00,-192281.00,-0.46
66.715,Lead Educational Outreach and Baseline Assessment of Tribal Children's Exposure and Risks Associated With Lead,2009,Environmental Protection Agency,0.00,,0.00,0.00
66.716,"Research, Development, Monitoring, Public Education, Training, Demonstrations, and Studies",2009,Environmental Protection Agency,9259200.00,5564039.00,-3695161.00,-0.40
66.717,Source Reduction Assistance,2009,Environmental Protection Agency,1058785.00,1181393.00,122608.00,0.12
66.718,National Community-Based Lead Outreach and Training Grant Program ,2009,Environmental Protection Agency,0.00,835000.00,835000.00,
66.802,"Superfund State, Political Subdivision, and Indian Tribe Site_Specific Cooperative Agreements",2009,Environmental Protection Agency,146000000.00,164936938.00,18936938.00,0.13
66.806,Superfund Technical Assistance Grants (TAG) for Community Groups at National Priority List (NPL) Sites,2009,Environmental Protection Agency,912476.00,1112467.00,199991.00,0.22
66.808,Solid Waste Management Assistance Grants,2009,Environmental Protection Agency,1840000.00,2465832.00,625832.00,0.34
66.809,Superfund State and Indian Tribe Core Program Cooperative Agreements,2009,Environmental Protection Agency,8000000.00,6189822.00,-1810178.00,-0.23
66.810,Chemical Emergency Preparedness and Prevention (CEPP) Technical Assistance Grants Program,2009,Environmental Protection Agency,75000.00,75000.00,0.00,0.00
66.812,Hazardous Waste Management Grant Program for Tribes,2009,Environmental Protection Agency,304000.00,550068.00,246068.00,0.81
66.813,"Alternative or Innovative Treatment Technology Research, Demonstration, Training, and Hazardous Substance Research Grants",2009,Environmental Protection Agency,500000.00,1840894.00,1340894.00,2.68
66.814,"Brownfields Training, Research, and Technical Assistance Grants and Cooperative Agreements ",2009,Environmental Protection Agency,5231555.00,5170543.00,-61012.00,-0.01
66.815,Brownfield Job Training Cooperative Agreements,2009,Environmental Protection Agency,9400000.00,7750512.00,-1649488.00,-0.18
66.816,Headquarters and Regional Underground Storage Tanks Program,2009,Environmental Protection Agency,1120342.00,1416161.00,295819.00,0.26
66.818,Brownfields Assessment and Cleanup Cooperative Agreements,2009,Environmental Protection Agency,111897628.00,157772853.00,45875225.00,0.41
66.926,Indian Environmental General Assistance Program (GAP),2009,Environmental Protection Agency,57925000.00,48087358.00,-9837642.00,-0.17
66.931,International Financial Assistance Projects Sponsored by the Office of International Affairs,2009,Environmental Protection Agency,2300000.00,2742540.00,442540.00,0.19
66.940,Environmental Policy and State Innovation Grants,2009,Environmental Protection Agency,565000.00,520000.00,-45000.00,-0.08
66.950,Environmental Education and Training Program,2009,Environmental Protection Agency,2244750.00,2244750.00,0.00,0.00
66.951,Environmental Education Grants,2009,Environmental Protection Agency,3180914.00,3034106.00,-146808.00,-0.05
66.952,National Network for Environmental Management Studies Fellowship Program,2009,Environmental Protection Agency,316085.00,,-316085.00,-1.00
77.006,U. S. Nuclear Regulatory Commission Nuclear Education Grant Program,2009,Nuclear Regulatory Commission,4800000.00,3194065.00,-1605935.00,-0.33
77.007,U.S. Nuclear Regulatory Commission Minority Serving Institutions Program (MSIP),2009,Nuclear Regulatory Commission,1392000.00,1105000.00,-287000.00,-0.21
